Index;Rocnik;Proza/Basen;Obsah
79;2;P;V tichu jarného podvečera sa hrabankou sunie kôpka tŕňov, kníše sa zboka nabok, chrúme, funí, mľaská a prská. Mladá ježulka si práve zháňa niečo pod zub. Zhltla už dve tučné mnohonožky, chrumkavého chrobáka, malú žabku, ale ešte vždy sa jej máli. S ňufáčikom pri zemi snorí, prevracia lístie, kúsky práchnivej kôry, kamene. Fučí, že ju počuť až na druhú stranu lesa. Tam si práve líška rovnako usilovne zháňa potravu. Keď' začuje funenie, zdvihne ryšavú hlávku, zastrihá uškami a poďho! Ježicu v okamihu vypátra. Priskočí k nej, ale vtom sa zháči. Pri nohách jej leží pichľavé klbko. Opatrne sa ho dotkne labkou, ale nech ho obracia z ktorejkoľvek strany, všade len samé bodliaky.. A pichajú až strach! Ani pomyslieť, aby doň zahryzla! Ježula svojimi krátkozrakými očami pred chvíľou možno postrehla pohyb alebo jemným ňufáčikom zavetrila nebezpečenstvo. Ako áno, ako nie, zmysly ju pred líškou včas varovali. Svaly okamžite reagovali na signál nebezpečenstva: stiahli nôžky i ňufáčik k chvostu a vďaka mohutnému podkožnému svalovému vaku sa tielko premenilo na guľu, z ktorej na všetky strany trčali vztýčené ostne. Nezostala medzi nimi jediná medzierka, jediný nechránený kúsok tela. Svaly sa zovreli tak silno, že sa pichľavé klbko nedalo rozbaliť. Liška si teda šla hľadať večeru inam. Klbko chvíľu nepohnute ležalo. Potom sa pohlo, opatrne sa vystrčil lesklý čierny ňufáčik, za ním drobné očká. A batôžtek ostňov sa už zase bezstarostne kolíše lesom a hlučne snorí ďalej. Kým sa nasýti, požerie toho neúrekom.
80;2;P;"Mama ma nepustila von. Povedala, aby som bol doma, že jej je smutno. Tak som bol doma. Mama sa radovala, ale teraz bolo smutno mne. Nemal som sa s kým hrať. Zuzanka spala, aby mala červené líčka. Aj Dunčo spal. Aj kanáriky spali. Len mama a ja sme nespali. Mama varila obed, ale ja som nerobil nič. Preto mama povedala: „Ivanko, hraj sa s niečím!"" V kútiku som mal koňa aj kocky. Pod oblokom som mal knižku o žltom húsatku a vo vrecku guľky. Niečo som nemal nikde. Povedal som mame: „Nemôžem sa hrať s niečím. Ešte si mi ho nekúpila."" Mama sa zasmiala a povedala: „Ty môj malý mudrlant!"" Nahneval som sa, ale len trošku. Potom som sa díval z okna. Na dvore do mláčky padali bublinky: cup, cup, cup! Opýtal som sa mamy: „Čo to padá do mláčky a do Dunčovej misky?* Mama sa pozrela z obloka a povedala: „Dážď"" Potom začala hádzať halušky do hrnca s vodou. Tiež tak robili: cup, cup, cup! Išiel som zobudiť Zuzanku a povedal som jej: „My budeme mať na obed varený dážď."""
81;2;B;"Mama má v očiach nezábudky, na lícach beláska. Keď mi je clivo, povie: „Poď, mamička si ta poláska."" A dych má ako harmanček, čo kvitne na lúkach. Keď ublížiš si, povie: ,Pod, mamička ti to pofúka"" I v strachu iba ku nej bežím, na perách joj  a beda! Otvorí náruč, povie: „Poď, mamička si ta nedá"" Nadídu mrazy, prituhne a vietor kopí záveje. Už pri dverách ma čaká: Pod, mamička si ta zohreje."
82;2;P;"Začalo sa to tak, že som sa pobral do sveta. A hneď po prvých ôsmich „Ach, ja nešťastný Osmijanko, akože pôjdem do sveta, keď' nohy sú jediný kilometroch ma začali bolieť nohy. Sadol som si teda na kraj cesty a zaplakal: V tej chvíli sa ozvalo tiché, ale energické: „Hav! Hav-hav!"" môj dopravný prostriedok a zdá sa, že by potrebovali generálnu opravu?!* Pozrel som tým smerom a uvidel som psa! Hlava maličká, bruško väčšie. Vyzeral ako chlpatá ležatá osmička, samozrejme, na štyroch labkách. „Vitaj, havkáč!"" povedal som tej brechajúcej osmičke."" Ako sa voláš a prečo na mňa brešeš? Psia osmička zavrtela chvostíkom a odbrechala: „Ahoj, Osmijanko! Nepoznávaš ma? Ja sa predsa volám Osmidunčo, som tvoj osmičkový pes a vôbec na teba nebrešem, ale sa s tebou slušne rozprávam!"" „Prepáč!"" povedal som."" Naozaj sa teším, že ma konečne vyňuchal môj vlastný pes. Ale ja idem do sveta a bolia ma nohy."" Osmidunčo zastrihal uškami: „To je maličkosť, kamarát! Veď každá normálna bytosť- okrem stonôžky - má predsa dve predné a dve zadné labky. Ja napríklad chodím po štyroch. Ty chodíš len po zadných. Tak si to na chvíľku vymeň!"" Urazil som sa: „No dovoľ! Predsa nebudem chodiť po štyroch!"" Osmidunčo zavyl: „Pane môj, akí sú len tí ľudia nechápaví! Nechoď po štyroch, ale po dvoch! Lenže po predných!"" Zamyslel som sa: „Pravdu más, Osmidunčo! Veď ja môžem chodiť aj po rukách!"" Postavil som sa teda na ruky a urobil niekoľko rukokrokov. Vtedy sa so mnou zakrútil celý svet, celý svet sa mi načisto obrátil a - bum! Hŕŕŕ! Pras! Fras! Našiel som sa v načisto obrátenej zázračnej krajine. Aj so svojím verným Osmidunčom tiež načisto obráteným hore labkami, Rozhliadol som sa. Pána Jána, to som ešte nevidel! Vyzeralo to ako zemská krajina, ale určite to nebola zemská krajina, lebo zem som videl nad hlavou a oblaky so slnkom aj s vrabcami a škovránkami boli mi rovno pod topánkami. A po nebi, teda vlastne po obrátenej zemi- frčali autá, lenže tiež hore kolesami a pospiatky. Hlava sa mi z toho trochu zakrútila a vravím Osmidunčovi: „Zdá sa, že sme v ryžovom nákype, čiže v katastrofálnej situácii! Čo budeme robiť v tomto prevrátenom svete? A pretože pes je po človeku najrozumnejšie zviera, Osmidunčo povedal: „Hav! Iné kraje, iné zvyky! Musíme sa prispôsobiť miestnym pomerom!"" A môj verný pes vykročil smelo dozadu s labkami vo vzduchu. Ani sa mu nezaplietli. Vykročil som teda za ním tiež dozadu a po predných labkách... pardon, po rukách. „Dobre, zahundral som Osmidunčovi."" Budeme sa prispôsobovať. Ale najprv treba kúpiť aspoň chlieb, lebo som hladný."" Uvideli sme dvanásťposchodový panelák, hore na prízemí obchod s nápisom NÍVARTOP MOD. „To je zrejme DOM POTRAVÍN- ako sa tak na to dívam odzadu povedal som Osmidunčovi."" Poďme dnu!"" Vošli sme na dvanáste poschodie a vybehli hore na prízemie, rovno do obchodu. „Dobrý deň,' pozdravili sme sa slušne potápačovi, ktorý sedel na hlave pod pultom."" Prosíme si kilo chleba."" Potápač sa k nám slušne obrátil chrbtom a vraví: „Neviete čítať? Toto je predsa nívartop moD, čiže Dom potravín, povedané vašou cudzou rečou. Tu sa odjakživa predávajú klince, pripináčiky a špagát. Chlieb si môžete kúpiť v obchode s obuvou. Trocha ma striaslo od prekvapenia, ale pískol som na Osmidunča a o chvíľu sme zastali pred obchodom IVUBO MOD  čiže DOM OBUVI. Predávali v ňom naozaj chlieb! „Prosím si kilo čerstvého chleba,"" povedal som zubnému lekárovi, ktorý tam predával. Zubný lekár mi podal chlieb, tvrdý ako skala. Keď videl môj zhrozený pohlaď, povedal: „Vidím, že ste cudzinci. Poučím vás teda. Chlieb, ktorý u nás vyrábame, je načisto tvrdý, po dvoch dňoch však načisto zmäkne. Na tretí deň bude teplý a vtedy najneskôr ho musíte zjesť, lebo na štvrtý deň by ste z neho mali cesto, na piaty deň múku a na šiesty- pšenicu. My sme totiž načisto obrátená krajina, to je naša pýcha!"" „To nič!"" povedal som."" My sa prispôsobíme. Beriem teda chlieb. Koľko platím?"" Zubný lekár vyvalil oči - to jest vošli mu skoro celé do hlavy. „U nás predsa kupujúci neplatí!"" povedal celkom zhrozený našou nevedomosťou."" Keď si u nás niečo kúpite, zaplatíme my vám!"" a zubár mi podal chlieb ak nemu peniaze. Hlava sa mi znova zakrútila a zmizli sme aj s Osmidunčom ako blesk dole komínom, čiže preč. „Hav!"" povedal môj verný pes."" Ten chlieb sa vôbec nedá rozhrýzť. Poďme niekam, kde dávajú obedy!"" Išli sme. Tam, kde bolo napísané ŇELÁDEJ  čiže JEDÁLEŇ- vyrábali motocykle. Po dlhom blúdení sme sa dozvedeli, že obedovať môžeme v bufete zvanom YDEJ- čiže JEDY. Naozaj, pri obrátených stoloch sedelo dole hlavou plno ľudí. Tiež sme si sadli a tiež dole..."
83;2;P;"V istom starom domčeku bývali dve mačky. Jedna mala ružové oči a modrú zásterku, druhá mala modré oči a ružovú zásterku. Tá ružovooká sa volala Princina, tá modrooká sa volala Lízička. Raz si povedali: „Treba sa nám vzdelávať, treba sa nám zabávať. Kúpme si televízor!"" A aj si kúpili. Priniesli stolík, na stolík dali obrúsok, na obrúsok kaktus, nad kaktus na stenu obraz deda Cičina v parádnom klobúčiku, zelenej bombajke s puškou a myšou veľkou ako Michalská brána. Doprostred celej tej krásy postavili nový televízor. Keď všetko dokončili, Princina v modrej zásterke hopla na ružovú stoličku, Lízička v ružovej zásterke hopla na modrú stoličku, pekne si sadli, kitkat chrumkali a pozerali sa, pozerali. Na druhý deň, len čo vstali, neumývali sa, nečesali, hneď k televízoru sadli a dívali sa na ĎALEKÉ KRAJINY! Videli more, cudzie stromy a cudzí strašný les, v ktorom strašný revúň naháňal ešte strašnejšieho pazúrnača a ten naháňal ešte strašnejšieho zubáča a ten zubáč naháňal toho najstrašnejšieho pichliača, pupkáča, dupipupkáča. Toľko sa tam naháňali, až sa obrazovka zapotila. Lízička sa bála, no Princina poutierala obrazovku vreckovkou a zase sa dívali na strrrrrrašnú naháňačku až do noci. „Och, aké to bolo hrozné,"" povedala Lízička. „Och, aké Vzrušujúce,"" povedala Princina. „Teraz už vieme všetko o ďalekých krajinách!"" volali obe. „Ako dobre, že máme televízor, áno, áno!"" Na tretí deň mačky vstali, neumývali sa, nečesali, nejedli, mliečko nepili, k televízoru skočili a videli -ZAJAČIU ESTRÁDU. Najprv zajace z materských škôl skákali ponad žihľavu a cez švihadlo. Najlepší dostali knihu. Potom zajačí kúzelník ťahal z klobúka celkom malulinké zajčúliky. Učený zajac hrýzol kaleráb a tí menej učení mu tlieskali. Jedna dobrá zajačia duša rozdávala balóniky, zajačí reportér dával hádanky: „Skacká to okolo chalupy, robí to cupity, cupy. Čo je to? „Sú to zajace,"" volali zajace. „Sú to kocúry.""  volala Lizička. Je to dážď povedala múdro mačka Princina. „Naozaj, vonku prší, p0zrela sa Lízička oblokom. „Všade plno vody a naše gumáky sú v oprave. Lenže my nemusíme ísť von do dažďa a ešte sa aj dozvieme všetko života zajacov! Ako dobre, že máme televízor, áno, áno."" Na štvrtý deň mačky vstali, neumývali sa, nečesali, nejedli, mlieko nepili, k televízoru skočili. Prachu kopa všade ležká, po záclonách pavúk beží. No mačky iba sedia a dívajú sa na NAOZAJSTNÚ KRÁĽOVNÚ. Kráľovná ležala na hojdačke. Traja zlato-zelení a traja zeleno-zlatí papagájí ju hojdali. Černoško ju ovieval. Bubeník jej bubnoval. Dvanásť ministrov v čiernych nohaviciach jej tancovalo a páv, zo všetkých pávov najpanovitejší, jej spieval: Haju, haju, hajušky, kráľka varí halušky, pán kráľ krája slaninu, urobia si hostinu. „Och, aké vznešené,"" volala mačka Princina. „Och, aké nezvyčajné,"" volala mačka Lízička. „A aké zábavné,"" volala mačka Princina. „A aké poučné,"" volala mačka Lízička. „Teraz už vieme o kráľovnách kráľoch všetko! Ako dobre, že máme televízor, áno, áno."" Na piaty deň: pozrieť strach, sto pavúkov na záclonách! Po kredenci pochodujú, V mliečnom hrnku disko majú – pekný poriadok! No tie mačky nečesanice nikoho a nič si nevšímajú, len sa hrnú k televízoru a pozerajú sa, pozerajú a VEĽKÉHÔ KRÉSLIARA ĎURKA ŻMURKA. Ďurko Žmurko je najväčší kresliar z druhej triedy v škôlke na Malej ulici. Teraz práve ukazuje, ako treba kresliť žirafu. Treba spraviť jednu hlavu, jeden krk, jedno telo, jeden chvost. To je ľahké. No čo s nohami? Koľko ich to zviera má? Ďurko nakreslí dve. Ďurko nakreslí tri. Durko nakreslí štyri. Ďurko nakreslí päť. Ďurko nakreslí šesť. Durko nakreslí sedem nôh! A na každú paprčku peknú teplú papučku. Nech je žirafe blažene! „Aké zaujímavé,"" volala mačka Princina. „Aké poučné"" volala mačka Lízička."" Len sa mi vidí, len sa mi tak marí, že žirafa má osem nôh!"" „Veru nie, má ich päť!"" povedala múdro mačka Princina."" Celkom isto viem, že žirafa má päť nôh!"" „Áno, áno, päť"" súhlasila Lízička."" Ale ináč ju nakreslil výborne."" Teraz už vieme o kreslení žiráf všetko,"" volali nadšene obe mačky. „Ako dobre, že máme televízor, áno, áno."""
84;2;P;"Žila žaba a mala tri žabky. Učila ich krákať, učila ich plávať. Ale žabkám sa všetko lenilo. Ba nechcelo sa im ani jest, iba keď ich matka nakŕmila. slniečku. Išli tade dvaja chlapci. Raz sa žabky vypekali na Prvý povie: „Dobre je tomu, kto si u škrečka svoje vyslúži."" Druhý povie: „Dobre by bolo i nám, keby nás vzal do služby: Žabky to počuli. Keď chlapci odišli, hneď sa ozvala najstaršia: „Sestry tri, sestry tri. Ja by som radila, aby sme aj my išli ku škrečkovi do služby, aby nám dobre bolo."" Tretia iba hlavou kývla. Už sa pohli a slovka neprehovorili, kým neprišli „Veru, veru,"" prisvedčila druhá. k samotnému škrečkovi. Škrečok bol maličký, ufúľaný od roboty celý celučičký. Iba oči mu do diaľky svietili. Takú mal v nich moc, že na koho pozrel, hneď' videl, kto čo je. Ani vypytovať sa nemusel, nemohla naučiť ani plávať, ani kŕkať. Všetko sa im lenilo. Len čo pozrel na žabky, videl: doma sa im nechcelo robiť. Ba mamka ich I povie: „Dobre ste prišli. Práve dnes sa začína u mňa najľahšia služba. Kto si ju vyslúži, nemusí viac ani prstom pohnúť! Vietor ho odnesie, kde sa mu zachce."" „Dobre bude, dobre bude,"" tešili sa žabky. Hneď' sa aj dozvedeli, aká bude služba. Škrečok povedal: „Najstaršia z vás bude celý týždeň deň i noc hovoriť:."" My tri, my tri."" - Stredná: „Za zrno, za zrno.""  - Najmladšia: „Aj tak dobre, aj tak dobre."" Žabky pristali. Hneď sa pustili slúžiť. Sedem dní a sedem nocí neprestajne vraveli, čo im škrečok rozkázal. Najstaršia vždy takto: „My tri, my tri, my tri."" Stredná: „Za zrno, za zrno, za zrno."" A najmladšia: „Aj tak dobre, aj tak dobre, aj tak dobre. Ale keď' sa minulo sedem dní, sedem nocí, žabky za ten čas zabudli reč. Vedeli iba toľko, čo cez týždeň u škrečka hovorili. Tu sa škrečok spýtal najmladšej: „Či bude dobre, ak vám za službu nič nedám? Tá iba toľko vedela povedať: „Aj tak dobre, aj tak dobre."" „No, keď vám je dobre, nech vás vietor domov zaveje, povedal škrečok. Sotva to vyslovil, uchytil ich vietor. Zložil ich práve pred matkinou chalupou. Chalúpka je zatvorená. Klopú na oblôčik, až sa mamka z chalúpky ozve: „Kto je to? „My tri, my tri,"" odpovie najstaršia žabka. „Ej, z toho ja málo viem,"" vraví mamka. Neotvára, žabky dnu nepúšťa. Iba cez dvere volá: „Tade choďte, kade ste prišli."" „Aj tak dobre, aj tak dobre,"" ozve sa na to najmladšia sestra. A keď to raz povedala, čo mali robiť. Museli ísť svetom. Ale čo si vyslúžili, to mali. Vietor ich odnášal, kam sa im zachcelo. Raz ich zavial na veľký dvor. Na dvore stála stará hus a plakala, že jej umrelo húsatko. Plakala, nariekala a takto vyvolávala: „Kto mi len usmrtil moje najkrajšie húsatko?* Najstaršej žabke bolo starej husi ľúto. Chcela jej niečo povedať. I povedala, čo vedela: „My tri, my tri, my tri. „A prečo ste mi usmrtili moje najkrajšie húsatko? spytuje sa nahnevaná hus. Stredná žabka sa naľakala a povedala: „Za zrno, za zrno, za zrno. „Ej, veď zrna je tu dosť. Keď ste mi usmrtili moje najkrajšie žlté húsatko, tak vás zjem."" „Aj tak dobre, aj tak dobre,"" vykríkla najmladšia žabka. Len čo vykríkla, stará hus otvorila zobák a ham! Už je po žabkách."
85;2;B;"Papier znesie všetko, hovorieva dedko. Môžete ho skrčiť, vystrie sa, môžete ho šmariť do lesa. Keď' si trošku práce dáte, tak ho ľahko roztrháte ako gate. Hore-dolu počmárate, ponúkne vám druhú stranu, zas môžete čarbať na ňu. Kresliť haky-baky, robiť kliky háky Aka fuka funda luka, papier ani nezafňuká. Ako mača hravé poskakuje v tráve. Letí ponad mesto: „Kde je moje miesto?* Z koša trčí čísi chvost: „Mňau, veď je tu miesta dosť!"""
86;2;P;"Lukáško si vykračoval po chodníku a s chuťou hrýzol čokoládu. Papier z nej odhodil na zem, ani sa neobzrel, kam spadol. Papier vyletel do vzduchu, len čo sa doň oprel vietor. S$-íf-k! A už ho nebolo. Vznášal sa nad Lukáškovou hlavou. Lukáš si ho nevšímal. Iba čo sa zahnal rukou. Ako naschvál, práve tou, v ktorej držal čokoládu. Čokoláda spadla do kanála, ale papier lietal ďalej a Lukáška pošteklil za uchom. „Ideš!"" Papier nerozumel. „Čo dobiedzaš, ha?"" Papier sa vznášal nad zemou a Lukáška trpezlivo prenasledoval. Skrútil sa do guľky a trafil ho do nosa. Čo to stváraš? Prečo za mnou stále lietaš? Papierisko jeden!"" hneval sa Lukáš a papier dolapil. Šmaril ho na trávnik medzi ruže. Papier sa popichal o ich ostne, ale nevzdal sa. Rýchlo sa vyslobodil a spadol Lukášovi rovno pod nohy. „To si zase ty? Prečo sa stále za mnou tmolíš?"" dupkal Lukáš nohami a odkopol prenasledovateľa do mláky. V tom zadul silnejší vietor a papier bol opäť na slobode. A poďho rovno za Lukášom. Júj!"" zaúpel Lukáš, keď mu sadol ako motýľ rovno na čelo. Blato z neho mu „Roztrhám ta na márne kúsky! Čo si mi to vyviedol? hneval sa Lukáš a trúchlil zašpinilo celú tvár. domov. A papier? Letel, ako to papiere vo vetre dokážu, rovno za ním. ako keď' vietor ohýba konáre stromov. Ale tvrdohlavý papier zanovito letel „,Chod preč! Daj mi pokoj! Nedobiedzaj!"" pišťal Lukáš a rozháňal sa rukami, za Lukášom. „ECH, čo s tebou? zohol sa napokon Lukáš k papieru a vhodil ho do smetníka. „Aj tak ta budem mat o chvíľu v pätách,"" pomyslel si nešťastne. Ale tentoraz sa mýlil. Papier len spokojne zašuchotal Lukášovi na pozdrav a viac von nevyletel."
87;2;P;"Hneď za mestom stál les. Za ten les slnko zapadalo, v tom lese vetrík spával V lese rástli jedle krásavice, briezky parádnice, buky, duby, krivé borovice a do toho lesa dúha zaháňala dážď: „Heš, heš, do lesa bež!"" a červený smrek. Smrek stál na kraji lesa, preto naň slnko dlhšie svietilo, vetrík ho častejšie previeval a dáždik hustejšie polieval. Hore na strome si urobili hniezda škorce a čížiky, nižšie veverice a pod smrekom jarabice. Taký to bol smrek. O siedmej ráno prišiel do lesa človek. Na nose mal okuliare, v ruke ceruzku a na hlave strakatú čapicu. Na tú čiapku frklo slnko žltú farbu, nebo belasú, obláčik čisto bielu, o tú čapicu sa obtrela jahoda spod kríčka aj zelená trávička a zastoklo sa za ňu čierne pierko z havranieho krídla. Taká to bola strakatá čapica. Človek dlho prezeral les. Páčili sa mu jedle krásavice, briezky parádnice, buky, duby, krivé borovice. Potom sa opýtal: „Kto chce urobiť deťom radosť? Kto chce darovať drevo deťom na ceruzky?* Jedle krásavice povedali: „My nie! My nie!"" Po nich odpovedali briezky parádnice: „Ani my nie! Ani my nie!"" „Hľadaj inde! Hľadaj inde!"" Také to boli stromy. volali buky, duby a krivé borovice. Na kraji lesa stál smrek. Odtiaľto ďaleko videl a všeličo počul. Videl školu s červenou strechou aj deti v škole a vedel, že potrebujú ceruzky. Ja dám deťom drevo na ceruzky!"" povedal červený smrek. „Dobre!"" odvetil človek. Potom červený smrek ľudia spílili a odviezli do mesta. V meste bola továreň ceruzky. V továrni drevo rozrezali na väčšie, menšie a celkom malé kolíčky. Kolíčky namočili do vody, dlho ich varili, sušili, glejili a leštili. Do každého kolíčka vydlabali žliabok a naliali do neho farby zo strakatej čapice. Žltú zo slnka, modrú z oblohy, bielu z obláčika, červenú ako jahoda spod kríčka, zelenú ako trávička a čiernu ako pierko z havranieho krídla. Také to boli ceruzky. Deti v škole vykríkli: „Nech žijú ceruzky!"" a začali písať a kresliť. Danka napísala: „Hneď za mestom je les."""
88;2;P;Poznáte kvety, čo rastú na močiaroch a žiaria ako slniečka? Je to záružlie. Chcela som si natrhať záružlie do vázy, aby mi malé slniečka pomarančovej farby žiarili v izbe na stole. Aby sa na mňa usmievali aj večer, keď' už slnko zájde. Aby mi bolo stále veselo a milo. Brodila som sa po močiari a premočila som si celé topánky. Skoro po kolená som sa prepadávala do riedkeho bahna. Záružlie sa na mňa usmievalo. Doma som dala kvety do vázy s vodou. O chvíľu boli zvädnuté. Viseli dolu hlavou -už sa neusmievali. A vo váze nebolo ani kvapky vody. Kam sa podela? Kvety ju vypili. Naliala som novej vody - aj tú vypili. To sú ale pijani! Usmievajú sa iba dovtedy, kým majú čo piť. Pijú a pijú, veľa vody popijú, a predsa nevypijú všetku vodu z močiara. Keby ich nebolo, možno by bolo močiarov oveľa viacej.
89;2;P;Marek má osem rokov. Sedí vo svojej izbe a číta si obľúbenú knižku, keď tu zrazu bez zazvonenia, bez zaklopania vtrhnú do ich bytu. Štyria. Nevyzujú sa, rohožku nepoužijú, ale zato riadne dupú, ryčia a vyjú. Najprv poskákali po gauči a posteliach, rozryli koberec: čo ak sa tam nájde niečo dobré? Potom s chuťou zjedli všetko, čo našli na stole v kuchyni, a skontrolovali zásoby v špajze. Mareka trochu ponaháňali, pohrali sa s jeho hračkami, potrhali mamine naškrobené záclony a podvečer sa unavení pobrali domov. Bez pozdravu. Ani mú! Páčilo sa im však, zajtra sú tu zas! Aprílový žart? Vôbec nie. Bola to len malá návšteva z lesa: diviak, líška, srnec a hlucháň. A že sa správali čudne? Vôbec nie. Veď presne takto sa správal Marek, keď minule prišiel na návštevu do lesa. Na návštevu? Áno, pretože les je domovom pre zvieratá. My ľudia sme v lese iba hostia. A čo ty? Ako sa správaš v lese? Ako hosť? Premýšľaš niekedy nad tým?
90;2;P;"Smutný život žila, na smetisku hnila. Bola stará, celá ošúchaná, nemala ani jednej struny. „Tá si už veru nezahrá, vravel každý, kto prechádzal okolo. Najmä tí, čo sa rozumeli muzike. Hovorili, že tá gitara je naozaj nanič, že jej chýbajú nielen struny, ale aj všetky kolíky. Šiel okolo ďalší. Hudbe sa vôbec nerozumel, mal však nesmierne rád vtáčiky. „Aká dobrá búdka,"" povedal, lebo každá gitara je v strede deravá. Vzal gitaru a zavesil ju v lesíku za mestom na strom. Bol to malý nezaujímavý lesík, nik doň nechodil. Ani vtáky v ňom nehniezdili, lebo kuna im tu kradla vajcia. „Teda sem sa tá zlodejka nedostane, povedala si drozdica a zniesla do gitary šesť vajíčok. Vyliahlo sa šesť drozdíčat. Ked vyrástli, spievali zborovo, až sa ozýval celý lesík. Do lesíka začali chodiť ľudia. Veselý spev ich priťahoval. Veľmi často bolo počuť za mestom takýto rozhovor: „Kam ideš?"" „Do lesa."" „Do ktorého"" „Do toho, čo vyhráva na gitare."""
91;2;P;Všimol si si, že náš svet je farebný? Farebné sú stromy na jeseň, kvety na jar, ovocie v lete, polárna žiara v zime. Farebné sú ryby, vtáky, motýle a iné zvieratá. A farební sme aj my ľudia. Preto je svet pestrý a zaujímavý. Ľudia žijú v rôznych končinách sveta. Nikde je teplo, inde zima, niekde jedia mango, inde zasa sobie mäso. Niekde chodia nahí a stavajú si domy z palmových listov, inde sa za nahotu hanbia a kupujú si tričká a nohavice vo veľkých obchodoch.. Žijem v Japonsku. Písať sa učím aj desať rokov, pretože naša abeceda je oveľa ťažšia ako vaša. V škole sa dokonca učíme, ako sa skryť pod lavicu v prípade zemetrasenia, lebo tie sú u nás často. Žijem v krajine, kde vymysleli lego. Leg a godt znamená v preklade hraj sa dobre. Skoro všetky deti tu majú svetlé vlasy. Som z Dánska. Žijem obklopená žirafami, slonmi, antilopami a zebrami. Banány si nikdy nekupujem v supermarkete, trhám ich rovno zo stromu. Som z Afriky. žijem v Kanade. Zima tu trvá až deväť mesiacov a niekedy je aj mínus 40 stupňov. Preto nosím sobie kožušiny. Žijem v Strednej Amerike. Doma pestujeme kávovník. Jeho zrelé bobuľky sa podobajú na čerešne. Môj otec ich dokáže za deň obrat až 25 kilogramov.
