Index;Rocnik;Proza/Basen;Obsah
174;1;P;Mrkvičkovci sú obidvaja strapatí. Nie že by azda Mrkvičkov nemali hrebeň - majú ich až päť. Ale čo z toho, keď miest, kde sa dá hrebeň zapotrošiť, je oveľa viac ako päť. A tak sa Mrkvičkovci češú rukami: roztiahnu prsty a prehrabnú si vlasy. Blížilo sa Jozefa, a to sú meniny obidvoch Mrkvičkovcov. Kúpim otcovi hrebeň, rozhodol sa syn Jožko, aspoň sa aj sám budem mať čím učesať. Patrilo by sa kúpiť niečo synovi na meniny, uvažoval aj Jozef Mrkvička starší. Aspoň hrebeň. Bude aj darček, aj sa budem mať čím učesať. A tak si na Jozefa darovali po hrebeni. Celí uveličení sa hneď vzorne učesali a vybrali sa do kina, lebo práve dávali dobrý film. Na druhý deň si však zasa museli vlasy prehrabnúť prstami. Mali síce až sedem hrebeňov, to je pravda. Ale čo z toho, keď miest, kde sa dajú hrebene zapotrošiť, je oveľa viac ako sedem.
175;1;P;"Bolo prekrásne leto a Klárka bola u starých rodičov na dedine. Práve sedeli za stolom a raňajkovali, keď deduško tajne predviedol Klárke, že si do úst strčí celé vajíčko uvarené natvrdo. Klárka to tiež skúsila, ale zahliadla starká a prísne povedala: „Ale Klárka To musíš opakovať každú hlúposť, ktorú dedko urobí?"" Po raňajkách deduško spiklenecky zašepkal: „Vieš čo? Dnes budeme po celý deň vystrájať hlúposti!"" Najskôr sa tí dvaja vydali do lesa. „Tu budeme zbierať hríby!"" zajasal dedo. Siahol do batohu a vytiahol album na známky. Klárke podal veľkú lupu a pinzetu. „Taká zbierka hríbov má veľkú cenu!"" zvolal nadšene a díval sa lupou do lístia. „Ach, tu je akurát vzácny Modrý hríb!"" radovala sa Klárka. Deduško zvolal: „A tento vatovec bude pýchou našej zbierky!"" Potom ale dlho nič nenašli. Deduško sa zamyslel a povedal: „Že my to nerobíme správne? Zbierame hríby, ale máme ich vlastne hľadať! Hľadať!"" A vytiahol ďalekohľad, mapu a buzolu. A chodili po lese a volali: „Hríbik! Ozvi sa! Už ťa hľadáme hodinu!"" Po obede šli zasa von. „Kamže?"" pýtala sa starká. „Ideme chytať ryby,"" odvetil na to dedko. Došli k rieke, Dedo si pískal a rozmotal klbko povrázku. Priviazal do bránky. Rozcvičil si kolená a potom zavolal na ktorá tiekla za dedinou. Na brehu rástli stromy. ho medzi duby a postavil sa k nim ako brankár Klárku: „Som pripravený. Hádž! a budem chytať."" Klárka sa čľapkala v rieke a robila sa, že deduškovi hádže ryby, a obaja sa pri tom strašne nasmiali. Keď sa vrátili späť, hlásil deduško: „Starká, ideme do záhrady. Budeme tam s Klárkou česať čerešne."" Starká bola spokojná, ale len preto, že nevedela, že deduško bude štekliť čerešne Kláriným hrebeňom na vlasy. Klárika zas pripínala čerešňovým vetvičkám sponky a dávala im farebné gumičky. A obaja pritom vypľúvali kôstky. V podvečer starká povedala dedovi: „Urob niečo poriadneho! Zalej trebárs kvetiny."" „Zalejem úplne všetky, ktoré uvidím,"" sľúbil slávnostne dedo a šiel si po kanvu. Nabral do nej vodu zo suda a zalial ruže aj aksamietnice. Lenže potom pokropil aj kvetinový obrus, ktorý sa sušil na šnúre. Ale najhoršie bolo, že nakoniec dôkladne zalial aj starkú v kvetinových šatách! A to nemal robiť. „Ach! Už mám toho tvojho bláznenia dosť!"" vykríkla starká. Chytila vedro, nabrala vodu zo suda a chrst! Poliala dedka od hlavy po päty. Vyzeral prekvapene. A Klárka vykríkla: „Ale starká, to musíš opakovať každú hlúposť, ktorú urobí dedo?"" Nato sa všetci začali ohromne smiať."
176;1;B;Vošlo do mňa skákadlo. Čo ho to len napadlo? Na ihrisku máme sólo: Skáče, sťaby z gumy bolo. Skáče vo mne a ja s ním. A vôbec ho nevidím. Mne sa to však k dobru ráta, že mám na hru kamaráta. Len mamke to pokoj nedá, že som taký neposeda.
177;1;P;"Z času na čas, keď bol deň voňavý a obloha dočista vyzametaná krídlami holubov, zjavoval sa v uliciach mesta predavač balónov. Volal sa Augustín Nedeľa - a bol veselý ako augustová nedeľa. Celý bol zaokrúhlený, a keď sa kotúľal mestom, pripomínal veľký balón. Aj hlavu mal guľatú ako balónik. Nosil na nej žltý slamený klobúk a zdalo sa, že ten slamenák nosí iba preto, aby mu hlava neuletela preč. balóny niesli jeho?) a vyvolával: Augustín Nedeľa niesol balóny ako veľkú pestrofarebnú kyticu (alebo to A každé jedno ,6"" mu vyletelo z úst ako malý balónik a rýchlo stúpalo k oblohe. za balónom, až boli všetky fuč! - Kúpte si balóóó6ÓŐ666666ny! Kúpte si balóóó6óÓŐ666666Óóóóóóny! Ruky detí sa naťahovali za tým pestrým strapcom, brali si z neho balón Ale vždy sa našlo jedno dieťa, ktoré prišlo neskoro, a tak sa mu nič neušlo. - To nič, - utešoval ho vtedy predavač balónov. - Nabudúce, keď bude znovu deň voňavý a obloha dočista vyzametaná krídlami holubov, zjavím sa znova a prinesiem o jeden balón viac – a ten balón bude pre teba! Možno by ste radi vedeli, odkiaľ mal Augustín Nedeľa toľko balónov. Nuž odkiaľ! Narástli mu v balónovom sade na balónovníkoch. Augustín Nedeľa urobil z farebných mydiel farebnú mydlovú vodu a vyfukoval z farebných slamiek farebné mydlové bubliny. Ale nie do vzduchu, kde by sa rozprskli na tisíc farebných čriepkov, ale do jamiek v zemi. Na tom mieste vyrástol strom balónovník a na ňom rástli samé balóny. Augustín Nedeľa ich oberal, až keď boli všetky zrelé. Ako to poznal? Hm - boli už také veľké a nepokojné, že skoro vytrhli strom balónovník z koreňov."
178;1;P;V každom poriadnom lese býva bosorka. Žije, čaruje a zbiera liečivé byliny. V našej hore má chalupu bosorka Žofka. Tá drevenica je plná vône. A sušené byliny voňajú prekrásne. Visia v dlhých radoch pod vyúdenou povalou alebo ležia naukladané na truhlici. Keď príde modrastý juhozápadný vietor, Žofka otvorí dvere i maličké okienka a povie: - Treba mi prevetrať chalupu... Vietor vonia sušenou šalviou a vo vlasoch má materinu dúšku. Takto ovenčený preletí svet. Ľudia sa nadýchajú a ako očarení utekajú do lesov. Vtedy si Žofka sadne na priedomí, oči sa jej lesknú ako studnica a vzrušene zašepká: -Čary sa podarili...
179;1;B;"Ježibaba menom Jana, zlostná, večne ufrflaná. Polievku si varí z húb, v ústach nemá ani zub. Ráno, večer stále dudre; popod nos si čosi hundre. Nahlas málo rozpráva, bez zubov je šušlavá. Raz vybrala sa do sveta, vraj chalúpku si nájde t Našla peknú, celkom novú; naozajstnú, perníkovú. Dnes všetky zuby mohla ma nemala ju ochutnať. Dobrá bola, že až beda, zjedla ju už doobeda. Zasmej sa však, zaraz tu je; skáče, dupe, vykrikuje: „Ja som strašná ježibaba, nesmejte sa, bojte sa ma! strašná som, strašný sen. Kto, sa smeje, toho zjem!"""
180;1;B;Bol raz jeden múdry kráľ, veľmi múdro kraľoval. V druhej zemi druhý kráľ taktiež múdro kraľoval. V tretej ríši tretí kráľ kraľoval a kraľoval. Tak tí traja múdri králi veľmi múdro kraľovali. Čuduje sa celý svet, že už hlúpych kráľov niet.
181;1;P;"Jedného dňa pani učiteľka Prvácka s úsmevom oznámila: „Zajtra sa pekne oblečte, pôjdeme do divadla,"" „Do akého divadla? Kto bude hrať? A čo budú hrať?"" vyzvedali deti. „Hrať budú naši žiaci. A bude to rozprávka o Šípkovej Ruženke."" „Kto bude hrať Ruženku?"" nedala pokoj zlatovlasá Simonka. „Nechajte sa prekvapiť,"" povedala pani učiteľka, pretože to ani ona nevedela. Ani nemohla vedieť, lebo Ruženku chceli hrať všetky dievčatá od piatej až po ôsmu triedu. Princa nechcel hrať nikto. Keď sa podarilo nájsť princa, tak zasa Ruženku nechcelo hrať ani jedno dievča. Nepáčilo sa im, že princa bude hrať chvastavý Imro zo siedmej triedy. Keď sa zdalo, že z divadla nebude nič, podarilo sa presvedčiť siedmačku Hanku. Tá si s Imrom poradí - jazykom sa vie poriadne oháňať. Imrovi sa jazyčnica Hanka nepáčila, a vraj on princom nebude. Pristal, až keď mu pani učiteľka sľúbila, že mu odpustí jednu pätorku, ak sa úlohu princa naučí. Na skúškach to vyzeralo tak, že sa Ruženka s princom viac vadili, ako skúšali. Preto pani učiteľka Prvácka nevedela, ? Hanka bude, alebo nebude hrať Ruženku. Divadelné predstavenie si nedal ujsť ani Smieško. Do divadla sa dostal schovaný v Jurkovom vrecku. Aby mu z predstavenia nič neušlo, usalašil sa na liste veľkej palmy priamo na javisku. Deťom sa rozprávka veľmi páčila. Prváčikom až tak žiarili očká. No iba dovtedy, kým sa Ruženka nepichla vretenom do prsta. Keď videli, ako nehybne leží, nejednému sa po líčku skotúľala slzička. A šťastného konca nie a nie sa dočkať. Princ Imro si nevedel poradiť s tŕním, ktorého bolo na javisku priveľa. Smieško sa už na detské slzy nemohol pozerať. Rozhodol sa, že Ruženku zobudí sám. Z palmy zobral pavúka, prikradol sa k Ruženke a pavúka jej položil na nos. Ruženka najprv kýchla. Keď však zočila veľkého pavúka, posadila sa a začala kričať: „Zachráňte ma! Na nose mám akúsi nohatú príšeru."" Jej kriku sa naľakal i princ. Prekoprcol sa cez tŕnie, zahnal sa dreveným mečom a osopil sa na Ruženku: „Čo vrieskaš, keď som ta ešte nezobudil!"" „Ty by si ma nezobudil ani do konca školského roku,"" zlostila sa Ruženka „A ľahni si, nech ťa už konečne pobozkám!"" „No a čo?! Keď spíš, aspoň čušíš,"" zahriakol ju princ. „Ani náhodou. Ja som už zobudená. A ty zalez do tŕnia a uč sa násobilku."" Deti sa smiali, tlieskali a kričali. Pani učiteľka, ktorá nacvičovala divadlo, v zákulisí omdlela. Kým ju pani učiteľka Prvácka kriesila, pán školník zatiahol oponu. Deti v hľadisku sa veselili. A Smieško? Ten sa ani prváčikom nepriznal, že zobudenie šípkovej Ruženky má na svedomí on."
182;1;B;Hurá, hurá! Už viem čítať! Nemusím viac prosiť mamu: Prečítaj mi túto stranu! A dobiedzať do sestry: Ešte aspoň vety tri! Keď je dlhá rozprávka nevyčkám na tatka. Všetko si už čítam sám a obrovskú radosť mám.
183;1;B;"Sme maličké, ale múdre,"" povedali písmená. Z písmen sú slabiky, zo slabík slová. Všetko vieme. A my sme krásne, povedali obrázky. Z obrázkov je svet. Všetko vám ukážeme."" A ja som múdra a krásna, povedala Čítanka. „Lebo mám písmená aj obrázky."" Všetko vás naučím."
184;1;B;Čo to čaká na prváka? Čo ho láka ako vtáka výška? Na prváka čaká prvá knižka. Otvorí ju ako bránu maľovanú a v nej písmen ako zrna. Každá strana plná.
185;1;P;Z čítanky musíme prečítať to, čo je tam napísané. Menším žiakom sa povoľuje urobiť menšiu chybu. Môžu napríklad prečítať namiesto slova orol slovo osol. Ale ani menší, ani väčší žiaci nemôžu prečítať namiesto slova orol slovo somár.
186;1;B;Sláva nám! Sláva nám! Sme prváci dobrí žiaci, nie nejakí darebáci. Statoční sme, bystrí, smeli, usilovní ako včely. My sme slávni prváci. Učenie nás všetkých baví, lebo máme dobré hlavy. Nemáme strach z abecedy, zmýlime sa len niekedy. Dobrá vôľa kameň láme, nuž si spolu zaspievame.. Sláva nám! Sláva nám! My sme slávni prváci!
187;1;P;Do školy treba chodiť tak, že máme nohy položené dolným koncom na chodníku. Nikdy nedvíhame obe nohy naraz, lebo je to veľmi nepraktické. Pri chôdzi nohy striedame. Najprv ide jedna, potom druhá. Nikdy nekráčame dozadu, lebo by ste prišli nazad domov.
188;1;B;Ententiky, dva špendlíky, sadli sliepky na pántiky. Ententiky, ja, ty, on, kto sa nehrá, z kola von! Ja som zajac, ty si pajác. Ja som rúčka, ty si kľučka. Ja som vrabec, ty si strapec Ja som pieseň, y si tieseň. Ja som vĺčik, ty si tĺčik. Ja som agát, ty si špagát. Ja som líška, ty si myška. Ja som húska, ty si Zuzka. Ja som zvonec, ty si koniec. Ententiky, ja, ty, on, kto sa nehrá, z kola von!
189;1;B;Anička maličká, poď si ku mne hopkať, kúpim ti čižmičky. čo ti budú klopkať. Hijo, hijo na koníčku, do Ratkovej po pšeničku, hijo, hijo na koni, pojedli psy tvarohy, iba jeden ostal, Jankovi sa dostal. Cip, cip, cipovička, mak, mak, makovička, cipovička cipová, : makovička maková. Osievame múčku v slamenom klobúčku, čo neosievame, pekárovi dáme, a čo zvýši, to Mariši, čo zostane, to Zuzane.
190;1;B;Ide pavúk po stene, kým sa Janko zasmeje ide pavúk po papuči, kým sa Janko nerozpučí. Ide pavúk po stene, nosí zlaté prstene, Anička sa raduje, ten jej jeden daruje.
191;1;P;Na malom dvore sa hral chlapček s loptou. Lopta urobila hop! a preskočila plot. Spoza vysokého plota zo zeleného drôtu volala lopta na chlapca: - Pod si po mňa, pod! Chlapček rozmýšľal, na čom by sa najrýchlejšie dostal k lopte Na lietadle? Nie! Na motorke? Nie! Na aute? Nie! Na loďke? Nie! Na vlaku? Nie! - Idem po loptu sám, - povedal chlapček. Urobil hop! a preskočil plot.
192;1;P;Najlepšie, čo ľudia vymysleli, je balón. Vážne. Neveríš? Pozri sa, ako letí! Ako sa vznáša! Balón, to je zabalený Vzduch. Je maľovaný a ľahučký. S balónom sa dá čarovať: pukne - nepukne? S balónom sa dajú robiť rozličné pokusy. Uletí mi? Neuletí? Balón dlho nevydrží. Stále ho to ťahá hore, preč a preč. Balón je pekná chvíľočka, keď mi je dobre. Keď sa mi oči smejú. Vie, že sa už nemôžu dočkať, aby potešili moje srdiečko ? vyniesli ho kúsok hore, k slniečku a modrým oblakom.
193;1;B;Ferko každé ráno mešká. Topánky si stále mýli. Pravú, ľavú naopak, obúvanie nemá rád. Viem, ktorá je nôžka pravá. Na mamku sa idem hrať. Nech to vie aj drobec brat.
194;1;P;Vieš si obliecť pančušky? Olinka vie. Palec do špičky. pätu do pätičky. Vidíš ? Pančušky majú špičky, päty a kolienka Rýchlo si ich obleč, lebo ti utečú von samy a teba nechajú doma. ako ty. Majú nôžky ako ty. -Mačička, vieš zašnurovať topánku? Mača mysli, že vie. Chytilo šnúrku do labiek a ťahá ju. - To musíš šnurovať krížom, pekne sem a tam, ako keď kreslíš stromček. Vieš ty vôbec nakresliť stromček? Ja viem, ale zašnurovať si topánku ešte celkom neviem. Mama, ani mačička to nevie!
195;1;P;Rodina je, keď ocko jednou rukou drží Tomáša a druhou mamu. A keď' mamička drží jednou rukou mňa a druhou ocka. Rodina je aj to, keď' sme všetci v cukrárni a ocko hundre: - Cukráreň je pre deti. Pre chlapa je futbal. Rodina je aj vtedy, keď jedna stará mama povie druhej starej mame: Aké to len máme pekné a spôsobné vnúčatká. Rodina je tiež to, keď' ocko leží vo svojej posteli, aj mamička leží vo svojej posteli a ja s Tomášom ležíme medzi nimi, aby sa nám nič nestalo.
196;1;P;Večer prišla mama k mojej postieľke a povedala: - Buď dobrý, Ivanko, a počúvaj tetu. Ja idem do nemocnice po malé bábätko. V nedeľu sa vrátim. Kým nájdete s oteckom meno pre bábätko, nedeľa tu bude raz-dva! Ráno sme sa hneď prebudili. Ocko vyskočil z postele a šiel telefonovať: Haló, nemocnica! Ja som čakal v posteli, kedy pôjdeme hľadať to meno. - Najprv si nájdi sandálky a obuj sa, - povedal ocko. Tak som ho počúvol. Našiel som sandálky, ale vôbec mi nešli na nohu. Išli mi naopak. Veľmi som ustal, kým som našiel svetríček a zubnú kefku! Hľadanie je ťažké. - Tak a teraz už môžeš hľadať meno pre sestričku. Práve sa narodila v nemocnici, povedal ocko. - Ja som už hľadal dosť! Ja už nechcem hľadať nič! - povedal som ockovi. Ocko sa zasmial a urobil kotrmelec. Aj ja som urobil kotrmelec. A potom sme našli to meno. Ivanka sa bude volať. Ako ja. Lenže Ivanka bude mať mašľu. A ja budem Ivanku strážiť. Aby sa nestratila. Lebo potom by mama zasa šla do nemocnice. Dobré je, keď je mama doma.
197;1;P;Najkrajšie oči sú čierne, - hovorila Evka. To nie! - vykríkla Katka. Najkrajšie oči sú belasé, lebo sú ako nebo. - Najkrajšie oči sú také, ako má naša mamička, - ozvala sa Milka. - Akúže majú farbu, keď sú najkrajšie? - spýtali sa ostatné dievčatá. - Či sú sivé, či čierne, alebo belasé? Milka sa zamyslela na chvíľu a potom odpovedala: - To ja neviem, akú majú farbu, len to viem, že sú zo všetkých očí najkrajšie.
198;1;B;Maľujem, maľujem krásny kvet. Taký kvet nevidel ešte svet. Maľujem, maľujem ako viem, mamičke tento kvet zanesiem. Tak ako tmavú noc rozjasní hviezdička, rozjasní u nás deň úsmevom mamička. Do ruky ti kvietok vkladám, moja milá mamička. Skloň sa ku mne, dám ti ešte horúci bozk na líčka. Čo všetko deťom k šťastiu treba? Slnko a modrý kúsok neba, piesok a v izbe s hračkami dva veľké bozky od mamy. Čo všetko deťom k šťastiu stačí? Hrozienko sladké na koláči a denne jedna hodinka V náručí svojho ocinka. Čo sa dnes deťom najviac ráta? Mať otca ako kamaráta, maminu dlaň a popritom mať vždycky lásky plný dom. Ľúbim kvety, ľúbim vtáčky, každú hračku maličkú, lež najväčšmi zo všetkého ľúbim svoju mamičku.
199;1;P;"Hraškovcov porátame na prstoch jednej ruky: otec, mama, dedko, babka a malý Miško. Žijú spolu v jednom dome, sedávajú pri jednom stole a zohrievajú sa pri jednom kozube. Ako inak, keď' sú jedna rodina? „Naša hviezdička, naša iskrička,"" hovoria dedko, babka, otec a mama Miškovi. „Čo budeme dnes robiť, svetielko naše?"" „Futbal hrať,"" navrhne Miško. „Hurá, futbal!"" tešia sa otec a dedko. „UŽ bežíme po loptu."" „Nijakú loptu!"" s kríknu mama a babka. „Stačí loptička. Aby chlapcovi neublížila. Nevidíte, aký je maličký?"" „Máte pravdu, ženy,"" povedia dedko a otec. „Pre Miška stačí pingpongová loptička. My veľkí budeme kopať prstami."" Futbal hrávajú každý deň. Vyhrávajú, prehrávajú a niekedy je nerozhodne. Tak to v živote chodí. „Si akási smutná, babka,"" prihovoril sa jej dedko. „Veru smutná,"" prikývla babka. „Mám ťažkú hlavu,"" povedala babka. „Prečo ju máš ťažkú?"" spýtala sa mama. „Lebo ju mám plnú starosti,"" povedala babka. „Už nie som obyčajná babka, ale prvákova babka. A ty, dedko, už nie si obyčajný dedko, ale prvákov dedko. A vy, rodičia, už nie ste obyčajní rodičia, ale prvákovi rodičia."" , „To nie je nešťastie, babka,"" povedal dedko. „Ostatné prvácke babky si od samej radosti spievajú.“ „Naozaj? spýtala sa babka. „Ak klamem, nech je zo mňa medveď!"" povedal dedko. Babka chvíľu čakala, či.sa dedko nepremení na medveďa. Keď sa nepremenil, spievala si aj ona."
200;1;P;Rastú dievčatá, rastú a zrazu si začnú želať, aby rástli rýchlejšie. Preto si obujú mamine topánky s vysokými podpätkami. A podpätky na maminých topánkach sú veľkí čarodejnici. Keď sa na ne dievčatá postavia, ihneď vyrastú aj o desať centimetrov, a to namojveru nie je málo. Keď si želajú rýchlejšie rásť chlapci, oblečú si otcove dlhé nohavice. Otcove dlhé nohavice sa však na krátkych nohách pozhŕňajú ako harmonika a chlapci vyzerajú veľmi smiešne. Chlapci nepoznajú tajomstvo maminých topánok. Nepoznajú ani tajomstvá zrkadla. A zrkadlo neklame, zrkadlo má rado pravdu a vždy hovorí len to, čo vidí. Preto dievčatá, keď sú doma samy, stoja pred zrkadlom v mamičkiných topánkach na vysokých podpätkoch a rastú.
201;1;B;Na stoličke by som nesedel, ale kľačal. Pred každým obedom by som zjedol čokoládu. Po ulici by som chodil pospiatky. Nevysmrkal by som sa do vreckovky, ale iba poťahoval nosom.
202;1;P;Mami, vieš, že ja som vypadol otcovi z oka?  No, hovoria to všetci známi. Mirko sa zamyslel nad tým, ako vlastne mohol vypadnúť otcovi z oka. Húta - veď oko je vlastne maličké, možno ho aj viečkom zakryť, ako môže z neho niečo vypadnúť? A ešte k tomu taký veľký chlapec, ako je on sám, veď bude onedlho školák. - Mami, a čo všetko môže z oka vypadnú? Ale Mirko, nikto nikomu z oka nevypadol. To sa iba tak hovorí o deťoch, čo sa veľmi podobajú na svojich rodičov, akoby to boli oni sami, ibaže mladší a menší. Mirko sa zasmial. Teraz už vie, že oči sú na to, aby sme videli rozprávky v televízii, aby sme si mohli prezerať obrázkové knižky, aby sme videli kvety i stromy v lese, ale nie na to, aby z nich deti padali. Večer sa na tom smiala celá rodina a keď ich takto našla stará mama, mohla si na nich oči vyočiť. Aááá, už sme zasa pri tom, že sa niečo ináč hovorí a ináč mysli.
203;1;P;Poznám viac domov. Ale len o jednom dome hovorievam, že som v ňom doma. To je ten dom, kde bývam s oteckom a mamičkou. Sú to moji rodičia. Starajú sa o mňa. Majú ma radi. I ja ich mám rád. Je nám spolu dobre. dom, Doma bývajú so mnou bratia i sestry. Spolu sa hráme a pomáhame si navzájom Všade dobre, doma najlepšie. Každý človek má ešte i druhý domov. To je naša vlasť, naša domovina - Slovensko.
204;1;B;Ja som šuhaj na svet súci. V bielom domci na Kysuci, tam kolíska moja stála, tam ma mamka vychovala. Ľúbim rodnej reči zvuky, rodnú obec. polia, lúky i potôčik vrtký, šumný, čo nám žblnká na záhum. Ľúbim zvuky rodných piesní jak v radosti, tak aj v tiesni. Aký spev! - Nikde vo svete nad slovenský nenájdete.
205;1;P;Bežal hrdzavý zajačik po medzi a zbadal krásnu púpavu. - Ako sa voláš kvietoček? - spytuje sa zajačik. - Púpava. - Akú máš krásnu kučeravú hlávku, púpava! Celá je z bielučkého páperia! Môžem ti ju pobozkať? - Ach, nie, nedotýkaj sa ma, zajačik, - za prosíkala púpava. Ale zajačik neposlúchol, pobozkal púpave bielu kučeravú hlávku a tá sa rozletela na všetky strany. Vietor odvial do poľa jej jemnučké vlásky.
206;1;B;Kdeže sa tu na lúčine vzala zrazu toľká krása? Púpavočka zlatým kvetom na slniečko usmieva sa. Teplejšie už slnko svieti, na lúke sú prvé kvety. Ja som prvá snežienka, mám studené kolienka. Sniežik ešte tu i tam, a ja sa u na Svet pýtam.
207;1;B;Zvoní modrý zvonček. Som voňavý domček. Pod, chrobáčik-modráčik, nie, nebudeš banovať... Pri slniečku budeš bývať, pri mesiačku stanovať.
208;1;P;Bol slnečný deň. Katka si vzala knižku a vybehla na lúku. A tam - pre krásu tisícich kvetov - na chvíľu pozabudla na učenie a len tak, od samej radosti rozbehla sa medzi kvety. Po chvíli zastala a zohla sa, že si niekoľko kvietkov odtrhne. Ktoré dievčatko by ich kráse odolalo? Vtom sa kvietky ozvali: Máš nás rado, dievčatko? Oj, a ako veľmi. - Netrhaj nás teda. My nerastieme a nekvitneme len pre teba. Chceme ešte žiť a tešiť sa z jasného slnka tak, ako sa ty tešíš z nás. Ako sme potešili teba, chceme tešiť všetkých ľudí, ktorí tadeto pôjdu. A máš rado med? - Pravdaže mám. - No vidíš. Z čoho by včielky robili med, keby nás nebolo? Sme tu teda nielen pre radosť, ale aj pre úžitok. Vtedy si Katka všimla aj včielky. Koľko ich len bolo na lúke! A ako usilovne z kvetu na kvet preletovali. Katka kvietky nežne pohladkala. Sadla si do trávy a roztvorila knihu.
209;1;P;"Boli raz dve husacie vajcia a v nich dve ešte nevyliahnuté húsatká. „Mne sa veru nechce vyliahnuť, mne je takto celkom dobre,"" vraví prvé húsatko. „Máš pravdu, načo by sme chodili, keď sa môžeme po hodine gúľať,“ vraví druhé húsatko. A tak sa teda gúľali, raz z briežka do doliny, raz z doliny do briežka. „Pozor, hrboľ!"" zacítilo prvé nevyliahnuté húsatko. „Uhni, 1ebo mi nefungujú brzdy!“ kričí druhé nevyliahnuté húsatko. Ale neskoro. Puk! Vajcia do seba narazili. Všetky hviezdy vidím!"" hovorí prvé vyliahnuté húsatko. „To nie sú hviezdy ale škrupiny,"" hovorí druhé vyliahnuté húsatko. A potom sa nevedeli vynadívať na všetku tú krásu okolo. „Aký je svet krásny, a nám, hlúpym, sa nechcelo vyliahnuť,"" priznali si obe húsatká a o chvíľu sa už popásali na zelenej trávičke."
210;1;B;Zniesla sliepka vajíčko. Jedno? To je máličko. Zniesla druhé vajíčko. Aj to bolo máličko. Keď ich bolo dvanásť- pane, tak si sliepka sadla na ne. A sedela, sedela. Až raz prišla nedeľa, škrupiny sa popukali, kuriatka z nich vykúkali. A keď prišiel pondelok, už si kvočka na dvor vedie dvanásť žltých kuriatok.
211;1;B;Naša mačka strakatá mala štyri mačatá, jedno čierne, druhé biele. a to štvrté strakaté, tretie žlté, preveselé, po mamičke okaté.
212;1;P;"Keď včely v úli pocítili teplo, vyleteli do záhrady a oslovili jablonku: „Jablonka milá, či nemáš niečo pre lačné Jabloň odpovedala: včielky? Dosť sme sa v zime nahladovali!"" „Zavčasu ste prileteli, včielky! Moje kvety sú ešte zabalené v púčikoch. Ohláste sa u čerešne!"" Zaleteli včeličky k čerešni. „.Čerešnička milá, či nemá niečo pre lačné včeličky?"" Čerešňa odpovedala: „Ešte ani jeden môj kvietok nevykvitol. Príďte zajtra!"" Zaleteli včely k tulipánu. Mal krásny, „Poďme domov, nič nenájdeme!"" veľký kvet, ale nebolo v ňom nič pre včely. hovorili smutne včeličky. Vtom zbadali v tráve učupený kvietok. Bola to fialka. Mala pre včely sladkú šťavu. Najedli sa včely a veselé sa vrátili domov."
