Index;Rocnik;Proza/Basen;Obsah
1;2;B;Škola je veľký dom. Škola je celá veľká. Žijú v nej školáci a pani učiteľka. Červenú strechu má a strecha komín v dyme. Aby tam detičkám nebolo zima v zime. Škola je vážny dom, celá je vážna škola. A Škola bez kvetov je ako jeseň holá! Nech teda zasvietia deťom v nej do svetlice, ak už nie slniečko, aspoň tie slnečnice.
2;2;B;Slovenčina, kto ti dal toľko nežných krás, že vždy ako potôčik zažblnkoceš v nás? Slovenčina najdrahšia, ty si poklad náš, to preto, že mamkino srdce v sebe máš.
3;2;B;"Sadí matka zrniečka do detského srdiečka: „Tu máš do vena.“  To je krása, už sa hlásia číre, zdravé ako voda z prameňa. Prvé slovo „mama"" čo je najbližšie. Potom „otec, čo ho kolíše.“ Hrnček, mlieko, krajec chleba..“  To je krása, naše dieťa dotýka sa sveta vôkol seba.“ Oblok, mračno ako hrad, kapsa, cesta, kamarát, rieka, more...“  A nad hlavou v čiernej hore plno zlatých hviezd. To je krása, naše dieťa dotýka sa rodnou rečou hviezd."
4;2;B;Klope ktosi dneska zrána: Otváraj sa, školská brána! Krásne klope, to mi ver, klope mesiac september. Na husličkách k tomu hrá, bránu školy otvára. Užije brána dokorán. Najmúdrejšia brána brán, Múdrosti je za ňou všade ako kvetín na záhrade. Bežíme dnu - sláva, sláva! Tuná deťom zmúdrie hlava.
5;2;P;Čo vám budem rozprávať, Tomáš pôjde zakrátko do školy a ešte si nevie poriadne ani šnúrky na topánkach zaviazať. Raz-dva sa mu rozviažu a vláčia sa po zemi. Nahnevali sa šnúrky na neporiadnika a povedali si, že od neho odídu. A tak veru aj urobili. Vyšnurovali sa z topánok a plazia sa po dvore. Kohút so sliepkou si svojím kuracím rozumom myslia, že to idú dvorom dve hnedé dážďovky, nuž poďho za nimi! Šnúrky vidia, že to vo svojom hneve prehnali, ale čo sa už dá robiť. Aj Tomáš vidí, že je zle-nedobre, rozbehne sa za šnúrkami. Horkýže rozbehne, topánky bez šnúrok mu padajú z nôh. Kohút so sliepkou tam boli skôr.“ Hádam len neprišla naša posledná hodina? Hádam nás len nezožerie táto nevedomá hydina? To radšej ukážeme tomu neporiadnemu Tomášovi, ako sa správne zaväzujú šnúrky, povedali a zaviazali sliepke a kohútovi zobáky na pevnú motýliu mašličku. Veru si Tomáš dobre všimol, ako vyzerajú krásne uviazané šnúrky, keď ich odväzoval kohútovi a sliepke zo zobáka. Tomáš pôjde zakrátko do školy a už vie, ako sa zdobia topánky pevným motýlikom. Vie, lebo dostal od šnúrok dobrú školu.
6;2;P;"Teta upratovačka to má ťažké. Ona je len jedna a rozhadzovačov v škole je presne štyristo. Teta upratovačka každý deň vymetá papieriky z cukríkov, žuvačkové obaly, igelitové vrecká, potrhané pijaky, omrvinky z rožkov, a raz...   dokonca našla v jednej triede slona. Patril Baltazárovi a bol nafukovací. A nielen nafukovací, ale aj nafúkaný. Ráno, keď ho Baltazár doniesol do triedy, bol celkom malý. Ale potom sa nafúkol, aký je vraj múdry! Všetko vie! Je múdrejší ako pán riaditeľ s ujom školníkom dohromady! Nafukoval sa, nafukoval- až mal vyše troch metrov. Teta upratovačka zalomila rukami. Čo robiť? Zavolať prvú pomoc? Hasičov? Do zoo? Vtom jej niečo zišlo na um: „Koľko je dva a dva?"" spýtala sa slona. Slon čušal, lebo nemal o tom ani potuchy. Darmo chodil do školy - slonia hlava nie je na matematiku. A tak od hanby spľasol a prestal byť nafúkaný. Teta upratovačka napísala na tabuľu odkaz žiakom."
7;2;P;Pekný vtáčik bol Janíčko. Nenaučil sa v škole pravopis. Lebo on tam nesedával na stoličke, ale na ušiach, Potom, pravdaže, vynechával dlžné a mäkčene. Nepodpisoval sa JANÍČKO, ale JANICKO. Priletel k tomu slovu iný vtáčik-štebotáčik a hneď prestal štebotať. Tak ho tie chyby ohromili. Rozhodol sa, že ich hneď opraví. Lenže ako, keď pri sebe nemal pero. Poradil si, vytrhol si pero z chvosta. Nemal ani atrament. Ale aj tu prišiel na nápad. Namočil si pero do modrého jazera. Lenže to jazero v skutočnosti vôbec nebolo modré, iba sa také zdalo. Náš vtáčik nebol z tých, čo sa tak ľahko vzdávajú. Chyby predsa len opravil. Opravil ich sám sebou.
8;2;P;"Vladkova mama odišla do práce a Vladko sa hral s vláčikmi, lebo ísť do školy bolo ešte včas. Hral sa, hral sa a hral, celkom na školu zabudol. A to sa stalo už tretí raz v tomto mesiaci.“ To nemôžem tak nechať, povedala si Škola, lebo mala Vladka rada.“ Idem ja poňho.“  Odfúkla si cez komín, zdvihla sa na nohy a pustila sa dolu ulicou. Vo Vladkovej triede mali práve matematiku, keď sa im zrazu dlážka naklonila a lavice sa pošmykli k stene. Aj počítadlo sa pošmyklo k stene. Potom sa dlážka naklonila na druhú stranu a lavice sa pošmykli k druhej stene. Aj počítadlo sa pošmyklo k druhej stene. Všetko lietalo raz sem, raz tam ako autíčka v lunaparku. A otvorené obloky kývali krídlami ako vtáky. Deti výskali od radosti, takúto zaujímavú matematiku ešte nemali. Pani učiteľka však zbledla a chytila sa za srdce - myslela, že nastalo zemetrasenie. A to sa len Škola uberala po ulici. Dopravný policajt jej dal zelenú a všetky autá sa dívali. Pred Vladkovým domom Škola zastala. Z oblokov vykuklo asi tridsať hláv a všetky zavolali: „Vladko, kde si?"" A ešte raz: „Vladko, kde si?“ Vladko pozrel na hodinky. Bolo štvrť na desať. Schytil tašku a vybehol z domu. Aj topánky si zabudol obuť. Bežal len tak v papučiach. Keď ho Škola zočila, chytro mu otvorila dvere a on do nej naskočil ako do autobusu. A potom sa zas vrátila na svoje miesto."
9;2;P;"Čože jedno písmeno, poviete si. Dajsarmisvete, jedno písmeno, keď je v abecede plno iných a krajších aj potrebnejších. Haha, moji milí, ono to nie je len tak. Veď keby nebolo „a, nebola by ani abeceda, ale v najlepšom prípade „beced“. Ani „mama“ by sa nemohlo napísať, iba ak ,mm“. Tata by sa písal „tt“, bába „bb"". Tak vám teda porozprávam, ako to bolo bez písmena „a. Ľudí to písmeno vedeli povedať, ale ho nevedeli napísať. Bolo to veľmi zle, pretože i detské časopisy museli byť pod menom Zornička, Včielka. Preto, keď bol Janko Harško v škole v prírode, napísal domov list, v ktorom bolo: Milí rodičia! Píše Vám Váš syn Janko Hraško zo školy v prírode. Je tu dobre. Včera svietilo slniečko, ale dnes už prší. Na obed sme mli plnenú papriku, zemiaky, n večeru krupicovú kauš. Bol veľmi dobrá. Len mi radšej pošlite trošku suchej slamy, pretože s bojím, že tú krupicu budeme mať častejšie. Bozky Vás Váš verný syn Janko Hraško. Rodičia prečítali list, urobili veľký balík, poslali ho synovi do školy n večeru krupicovú kašu. Bol veľmi dobrá. Len mi radšej pošlite trošku suchej slamy, pretože sa bojím, že tú krupicu budeme mať častejšie. Bozk Vám Váš verný syn Janko Hraško Rodičia prečítali list, urobili veľký balík, poslali ho synovi do školy v prírode. V tom balíku bol suchý slám i priložený list: Milý náš Janko! Sme radi, že s Ti v škole v prírode dobre vodí. Posielame Ti tú suchú salámu, hoci nevieme, načo Ti ju treba, keď iste spíte v posteli. Bozkávame ťa. Tvoji ustarostení rodičia. Janko odpísal druhý list: Milí rodičia! Veľmi zle ste mi to poslali. Ja som nechcel suchú slamu, chcel som suchú salámu, aby som ju mohol zjesť. Pozdravuje Vás Váš nešťastný syn Janko Hraško. Rodičia prečítali, zlomili ruky i povedali: „Veď on nechcel slamu, on chcel salámu!“ Tak to teda bolo, že rodičia posielali deťom do školy v prírode suchú slamu namiesto suchej salámy len preto, že na svete nebolo písmeno „a""."
10;2;B;"Jeseň, pani bohatá, farbí stromy dozlata, premaľúva celý sad. Zletel vietor, šiki-miki, hojdá všetky konáriky, vraj by stromy zobliecť rád. Vyhúda im celý čas: „Ide zima, bude mráz, pomrznete zaiste!"" Ale strom mu roz0smiaty ako dáky peniaz zlatý púšťa len list po liste."
11;2;P;"„Čo je tam, stará mama? spytuje sa dievčatko. „Pivnicá, Vieročka.“ „A môžem ta ísť?“ „Nie, nie, dieťa! V pivnici je tma, ešte by si sa udrela. A vieš...“  dodala tajomne, „tam býva bubák.“ Vierka vyvalila oči: „Bubák? A čo tam robí?“ „No, stráži nám pivnicu. „A on je aký?“ Jaj, radšej sa nespytuj!"" povedala stará mama a tíško sa zasmiala. Raz sa dievčatko hralo na dvore. Vtom sa mu lopta zakotúľala pivničným dverám. Ba či sú ozaj zamknuté? pomyslelo si a stislo kľučku. Dvere povolili a tichučko zakvílili. „Čo keby som sa pozrela, ako tam bubák stráži? zišlo na um Vierke. A už schádza pomaličky dolu schodmi. Aha, tu sú ešte druhé dvere. Aj tie opatrne otvorí. V pivnici je chladno a naozaj tma, ale nie zas až taká strašná. A príjemne to tu vonia - čo vlastne? Čo to tu tak nezvyčajne vonia? A kde je bubák? O chvíľu si oči zvykli na prítmie a Vierka začala rozoznávať: v kúte stojí sud ? kapustou, za doštenou zápravou je hŕba zemiakov. To ony tak voňajú? Nikdy by nepovedala, ako príjemne voňajú zemiaky, keď' si tu tak pekne na kope ležia. Ale kde je bubák? Možno sa zľakol a skryl sa za sud...   Kuk, si tu? Hľadá Vierka za sudom i po všetkých kútoch- bubáka nikde. „Vierka, Vieročka, kde si?"" zaznel zvonku ustráchaný hlas. „Tu som, stará mama,"" vybehlo dievčatko z pivnice.“ Zabudla si si sem dať bubáka, tak ti strážim zemiaky a kapustu ja."
12;2;P;"Bol krásny deň a dráčikovi Háčikovi sa výborne letelo. Po chvíli ho však začali bolieť krídla. Práve letel okolo stromu a chvost sa mu zamotal do konárov. Sadol si teda na vetvu a odpočíval. „Podarilo sa mi zmiznúť. Nikto nič nezbadal. Dobre, že ma ocko naučil tak lietať. Možno budú rodičia z môjho odchodu smutní, ale keď' sa dozvedia o mojich hrdinstvách, dobrá nálada sa im rýchlo vráti,"" rozprával sám sebe dráčik Háčik. Ledva to dopovedal, už pred ním na konári poskakuje strapaté vrabča. A hneď doňho: „A ty si kto? „Kto akože je kto? nechápal zaskočený Háčik. „No ty, čo vyzeráš ako kyslá uhorka týždeň bez nálevu. A prečo sedíš na našom strome? „Ja tu nesedím. Ja som pristál. Toto je náš javor, odjakživa patrí vrabcom a nie je to nijaký prístav,"" zlostí sa strapáčik. „Tak prepáč. Vieš, ja som dráčik a volajú ma Háčik, lebo rád háčkujem."" „Ale ty nie si naozajstný drak!"" „,Som naozajstný, len trochu menší."" „Ja som už videl draka. Bol veľký, gúľal Očami a chrlil oheň."" „Aj ja viem gúľať očami,"" nedal sa Háčik. „Tak za gúľaj."" „Dobre ma sleduj!"" Háčik gúľal očami, až z toho. očervenel. Vrabča sa len zasmialo. „Takto viem gúľať i ja. Vôbec sa ta nebojím. A oheň chrliť vieš?"" „To som sa ešte nenaučil. Ale keď' budem veľký, budem chrliť strašný oheň."" strome? Veď si ho mohol zlomiť. Kde by sme potom bývali? Há? „No dobre, tak sa ta ešte nebojím. Ale prečo si pristál na našom „Vlastne som tu ani nepristál, Ako som si tak letel, zrazu sa mi zamotal chvost do konárov."""
13;2;B;Nemá rúk ani luk, strieľa do nás lúče. Čo je to? ale zato rúče Hovorí dážď, že má sestru, sestru krásnu, sestru pestrú. Čo je to? Letia nebom húsky, majú sivé blúzky. Dýchol víchor na húsky, rozkmásal ich na kúsky. Čo je to? V noci pasie zlaté ráno končí jeho vláda. stáda, Čo je to? Nemá krídel, nemá úst, vie však lietať, vie však húsť. Čo je to? o Sedí pani v údolí, z fajky sa jej kúdolí. Čo je to?
14;2;P;"Do našej dediny sa po sparnom lete doterigala ponurá jeseň. Jeseň sa začína v septembri, a to mamička lastovička už dávno vie. Ale jej deti Darinka a Roman ešte nevedia, čo znamená september pre lastovičky. Mamička nachystala chutné raňajky. Lastovíčatá sa najedli, ale aj vytušili, že im mamička chce čosi dôležité oznámiť. Po raňajkách priniesla z lastovičej komôrky niečo veľké papierové. „Čo je to?"" spýtala sa Darinka. „Mapa,"" povedala mama a rozprestrela veľký papier na malom stole. ,Čo je to mapa?"" spýtal sa Roman, lebo také slovo ešte nepočul. „To je zaznačený a nakreslený celý svet - moria, rieky, hory, jazerá, krajiny. Aha, toto zelené, to sú roviny, hnedé sú zase pohoria a modré rieky a moria."" „A kde sme my? spýtala sa Darinka. „Tu je naša krajina,"" ukázala mamička na mape malé miesto. „A tu neďaleko od Piešťan bývame my!"" „Akí sme maličkí!"" zhíkli deti. „AKO sa sem všetci pomestíme?"" „Dobrých ľudí a lastovičiek sa všade veľa zmestí,"" povedala mamka lastovička. Deti si obzerali mapu a krídelkami mávali nad hnedými horami a modrými vodami. „Deti, je tu september a vtedy lastovičky odlietajú sem,"" oznámila mama a ukázala krídelkom na svetadiel s nápisom Afrika. „A prečo?"" „Aby sme tu v zime nezamrzli. A aby sme aj v teplých krajinách - ako tu - pochytali všetky muchy. Ideme sa chystať na cestu."" Deti sa pozreli na mapu, po ktorej sa krídlami zniesli až k severnej Afrike. „Ale to je ďaleko, hrozne ďaleko."" „Ďaleko, deti, ďaleko."" Deti si trochu smutné - poupratovali detskú izbu, mamička zatvorila okná a dvere a spolu odleteli na Školskú ulicu, kde už na elektrických drôtoch sedeli stovky lastovičiek. Mamička s deťmi prileteli k vedúcemu letu. „Kedy sa odlieta, pán vedúci?"" „Čoskoro, večer - o šiestej. A deti sa tešia?* „Tak napoly,"" povedala Darinka."" Bude nám smutno, lebo tu necháme našich kamarátov Ninku a Filipa."" „Sú to naši najväčší kamaráti, vlastne ani iných nemáme, no, a ešte ježa Olivera,"" pridal sa Roman. „Budete sa mat ku komu vrátiť... No tak sa choďte s nimi rozlúčiť, lebo o chvíľu odlietame."""
15;2;B;Leje lejak lejavý na strechy aj na hlavy, leje lejak, lejačisko na škôlku i na ihrisko. Hustý dáždik šuští v húšti to, čo nikto nerozlúšti. Je to strašne mokrá reč, každý radšej beží preč. Kto však hladí do dáždička, vidí kvapky- lesklé sklíčka. Kam tie kvapky letia, kam? Nech sa každý pozrie sám.
16;2;P;"Rozpršalo sa. Bol teplý dáždik a dedko povedal, že padá zlato. Majstroval na verande rozheganú stoličku. Maroš chvíľu hľadel na dedka, potom ho to omrzelo -a hybaj do dažďa. Dedko pohrúžený do roboty veru nezbadal, kde sa mu vnuk túla, a stará mama sa krútila v kuchyni okolo sporáka. Odrazu len pribehne chlapec na verandu a volá: „Pozri, dedko, našiel som slimáka."" „Keď prší, slimáky vychádzajú na prechádzku,"" vraví dedko. Až potom zbadal, ako Maroš premokol: „Prepánajána, nechoď na dážď takto naľahko, raz-dva prechladneš! Keby ta videla stará mama, mali by sme obaja po chlebe!"" Maroš položil slimáka na verandový múrik a prihovára sa mu: „Vyjdi, slimáčik, z domčeka!"" A slimáčik sa onedlho naozaj vytiahol z ulity a dal sa liezť. „Dedko, pozri sa, ako slimák vyplazuje oči."" Dedko sa zasmial: ,Vraj vyplazuje.""  Ale nezdvihol oči od roboty. „Len sa pozri! Pozri sa!"" kričí Maroš. Dedko nechal robotu a prišiel k múriku. A ako slimák vystrčí oči, · Maroš sa ich dotkne prstom a stopky s očami sa rýchlo schovajú. „Vidíš, dedko, vidíš?"" „Vidím, vidím, vnúčik, ale vyplazuje sa jazyk, a nie oči,"" vraví dedko. Ja vyplazujem jazyk, aj ty, dedko, vyplazuješ jazyk, stará mama tiež vyplazuje jazyk a najviac ho vyplazuje Viktorka, ale slimák vyplazuje OČI. Len sa lepšie prizri, dedko!"" „Ale veď aj riekanka vraví: Slimáčik-máčik, vystrč rožky, dám ti masla A na parožky...""  poúča dedko vnuka. Maroš na to: „Dedko, to nie sú parožky ani rožky, ale oči na stopkách. Darmo dedko tvrdil, že aj keď sú to oči na stopkách, slimák ich nevyplazuje, A on ich naozaj vyplazuje. ale vystrkuje. Maroš si len húdol svoje: „,Slimák vyplazuje oči, lebo nemá jazyk. Veď som mu hovoril: vyplaz jazyk, a on zakaždým vyplazil iba oči. A niečo predsa musí vyplazovať!"""
17;2;P;"Záhradná zelenina počula od kohosi, čo šiel okolo, že leto preletí ako vtáča-jarabáča. Preto vraj treba myslieť na zimu už teraz, aby nás neprekvapila. „Čo je to vlastne tá zima? ozvala sa inak mĺkva mrkva. „Zima, to je drkotanie zubami, keď niekto nie je dosť naobliekaný"" vysvetľuje jej pohotovo cibuľa. „A akej farby je zima? spýtal sa rajčiak. „Je biela ako ja,"" odpovedal karfiol. Ja odlietam na zimu za more,"" zašvitorila lastovička. Ja si nachystám z lístia teplú chyžu!"" zafučal v rohu záhrady jež. „A ja zaleziem čo najhlbšie do zeme,"" povedal jeho kamarát krt. Najväčšmi sa studenej zimy zľakli kapusta a kel. Začali sa horúčkovito obliekať: kabát na kabát, kabát na kabát, kabát na kabát...   Pór robil to isté, aj keď to nikto na ňom nepozoroval, lebo sa obliekal v temnej zemnej komôrke. Je smiešne ukazovať sa v horúcom lete naobliekaný ako cibuľa,"" poznamenal akoby nič. hlbšie do zeme, tak ako krt,"" nahlas premýšľal petržlen. „Ja sa tak hrubo naobliekať nechcem, radšej zaleziem Inokedy zasa zelenina počula, že aj ľadovo studená zima má svoje krásy. Vyzerá ako mladá nevesta. Celá je biela. Na hlave má z inovate závoj a pod nohami záveje mäkké ako perina. Najväčšia zimná krása je však snehuliak. A tak sa na zimu najviac tešia tí, čo sa rozhodli prezimovať vonku. Sú to známi otužilci: pór, chren a pažítka. Ale napokon nemohli obdivovať snehuliakovu nehu – pretože napadlo primnoho snehu. Ocitli sa pod hlbokou prikrývkou. Bola to krásavica mrkva, ktorá videla túto zimnú nádheru. A to celkom zblízka. Deti urobili z mrkvy nos snehuliakovi."
18;2;B;O Najprv šaty zelené, potom nosí červené. A keď už belasé má, s veľkou chuťou jest sa dá. Čo je to? o Sedí na hriadkach V samých záplatkách, kto ju okúsi, zaplakať musí. Čo je to? o Sedí pani v kríčku v červenom ručníčku. Čo je to? o Sedí pani v chládku v červenom kabátku, vlasy sú jej na slnci a ona je v chládku. Čo je to? O Plné bruško kamenia a červená suknička, jesenné sú znamenia, keď' si sadnú do kríčka. Čo sú to?
19;2;P;"Na rohu pod lipou zastala tučná predavačka gaštanov. Zatlačila vozík až k samému stromu a začala vyspevovať: „Gaštanýýý, pečené gaštanýýý! Teplé gaštanky! Gaš-ta-neč-ky!"" Z dvorov sa hneď začali zbiehať kupci. Predavačka len oči otvárala. Podoprela si boky, chytila do ruky lopatku a nedôverčivo si obzerala kupujúcich. Tí sa medzi sebou hádali, strkali, iba žaba na samom konci sedela a smutne gúľala okáľmi. Takú chuť mala na tie gaštany - a teraz ju všetci predbehli! „Tak dosť!"" dupla nohou predavačka a obrátila sa k prvému kupcovi. „Čo si želáte?"" Všetci zmĺkli, no najväčšmi sa zľakla hus, pretože stála na samom predku. Vytiahla dovysoka krk a začala: „Ga-ga-ga.""  Chcela iba jachtala, gagotala. povedať, že chce gaštany, ale stále Tučná tetka prekvapene zažmurkala, preložila si lopatku z jednej ruky do druhej a klop ňou hus po zobáku: „Čože? Ty mi tu chceš do večera gagotať? Ideš ho!"" Rad pred vozíkom sa zavlnil a pred predavačkou sa ocitol našuchorený kohút. Vypínal prsia a sekal vo vzduchu ostrohami, aby si dodal odvahy. „Koľko chceš tých gaštanov? spýtala sa netrpezlivo tetka. Kohút chcel povedať, že kilo, ale stále robil iba kikiki. „Ale už sa ber!"" zahnala sa po ňom namosúrená predavačka. Pred vozíkom s gaštanmi stála koza. Postavila sa na zadné nohy a maškrtne oňuchávala voňavý dym, ktorý sa dvíhal z horúceho plechu. „Koľko chceš  - kilo?"" spýtala sa predavačka kozy a už sa aj chystala naberať horúce gaštany. Koze sa od rozpáleného dymu pripálila brada. Chcela predavačke povedať, že chce menej, ale za nič na svete to nedokázala vysloviť. Dostala zo seba iba prvú slabiku a tú len donekonečna naťahovala: méćééméééé. Kôň sa zatiaľ nahol cez plech, že si všetky gaštany zoberie a ujde. Strčil pysk medzi gaštany a vyskočil vysoko, div že vozík neprevrátil. „Fíha! Fífffíha!"" Odcválal do svojho dvora, kde ho už čakal gazda. Na rad prišiel vrabec. Zatrepotal vo vzduchu krátkymi krídlami a pýta si gaštany: „Cviri, čviri! Štyri, štyri!"" Predavačka nabrala na lopatku štyri gaštany a ponúkla ich vrtkému vrabcovi. Vrabec vzal jeden do zobáka, ale hneď ho aj pustil. Gaštan ho popálil na jazyku a on s krikom odletel. „To sú mi teda kupci!"" hundrala namrzená predavačka, keď' sa všetky Juj, žaba! Vari aj ty chceš gaštany? A koľko?"" spytuje sa predavačka veselo. zvieratá rozutekali. Už chcela odísť, keď tu zrazu zbadá drobnú žabku. „Kvaky, kvaky, kvak, ja chcem plný vak! Žabka veselo odrapkala svoju prosbu a už aj podávala tučnej tete velikánsky vak. Predavačka vysypala do žabkinho vaku jeden plech gaštanov, potom aj druhý, žabka zaplatila a hop! Skočila za kameň, za druhý, za tretí a už jej nebolo."
20;2;P;"Majster Zachariáš mával v jarmočný deň bystré oči. Veru čosi pobadal, videl, ako si bratia Budkáčik a Dubkáčik šepkajú, aj si domyslel, o čom sa môžu rozprávať. A keďže nechcel prísť o učňov, ktorých mal iba raz v živote, nuž večer, keď bratia pospali, vzal povráža oboch si ich za nôžky priviazal. Veru ľahko mu bolo ráno učňov zobúdzať, nemusel sa báť, že mu svetom ujdú a on ich nikdy viac vidieť nebude. Žiaľno im bolo, smutno im bolo, no brúsiť museli, inej rady si nevedeli, a keď v jednej dedine všetko pobrúsili i všetky dáždniky poplátali, tískali brús do druhej dediny, z druhej do tretej, ba toľko dedín pochodili, že sa im už ani rátať nechcelo. V hanbe neobzerali sa už ani na domy, tým menej na ľudí, lebo im nik nechcel pomáhať. Až tu raz zastaví sa akási žena pri Zachariášovi a pekne sa mu prihovára. „Vitajte, už ste dávno u nás neboli, a či ste o prasiatkach Dubkáčikovi a Budkáčikovi vo svete nič nepočuli?"" „Veru som nepočul,"" odpovedal majster, „svet o nich v posledné časy neslýchal, azda sa už aj pominuli."" „Ej, to mi radšej ani nehovorte, dobrý majstrík, lebo by mi ich bolo ľúto,"" zaznel zasa ženský hlas a verní bratia obaja naraz poskočili. Známy im bol ten hlas, nuž trochu sa začali žene prizerať, a tu obaja naraz spoznali svoju gazdinú, od ktorej kedysi svetom ušli. „Už je po nás,, brat Budkáčik!"" „Už nám je smrť, brat Dubkáčik!"" zašepkali si bratia, za brús sa uchýlili. „Ak nás gazdiná uvidí, zaraz nás spozná a druhý raz už neujdeme spred mäsiara.""  Stúlili sa, uši opustili, oči prižmúrili a tak načúvali za brúsom. „Celý svet vie, že ste prasiatka radi mali,"" hovoril majster Zachariáš. „Ej, vie, aj môže vedieť, lebo takých prasiec viac na svete nebolo ani nebude."" „Len už neželáte, gazdinka, keď už aj z prasiat slanina nebude."" „Čože o slaninu, zavzdychala gazdiná, ,o slaninu ja dnes ani nedbám. Ale prasatá som mala tak rada, že mi je smutno od tých čias, ako ich nemám. Ani sa mi žiť nechce bez nich, a keby som ich ešte raz mala, za celý svet by ich zaklať nedala, iba by som ich do smrti zrnom chovala, tak by som sa s nimi zabávala."" Ako to bratia Dubkáčik a Budkáčik počuli, zaraz vyskočili, brús prekotili a razom vykríkli: „Gazdinka naša dobrá, veď sme my tu! Mäsiara sme sa nalákali, zato sme ušli, ale keď nás mäsiarovi nedáš, nechceme my inde byt, iba u teba!"" I pozhadzovali ľudské šaty, na štyri nohy sa spustili, zakrochkali, chvostíkmi zakyvkali a gazdiná hneď' pľasla dlaňami, lebo ich spoznala. Usmiala sa, po chrbte ich potľapkala, Zachariášovi ďakovala a taká bola rozveselená, keď vchodila do dvora, že ju gazda skoro nepoznal. A čo sľúbila, to zachovala, prasiatkam ublížiť nedala, ani sama im nič zlé nevykonala, a že sa vo svete naučili aj ľudským spôsobom, večierkami ich vždy do chyže voviedla. Mašličky im na krk uviazala, za stôl ich posadila, a keď sa do chyže naschádzalo ľudí, verní bratia Dubkáčik a Budkáčik rozprávali ľudom o svojich cestách. Veru rozprávajú i dnes."
