Index;Rocnik;Proza/Basen;Obsah
275;3;P;"Prišla pekná jar. Objavila sa prvá lastovička, za ňou všetky ostatné. Oli hniezda pod sindkovou strechou strigôňovho príbytku. Hneď bolo všetkým veselšie. Aj starý Vlkolak na priedomí šantil, vyskakoval a radoval sa, že už nemusí ťahať sane. „Najlepšie je slobodnému psovi!"" chválil sa lastovičkám. „Slobodný pes nemusí nič robiť, ani chytať muchy ako vy. Ja nemusím ani strážiť, veď kto by sa do strigôňovho príbytku opovážil? Slobodný pes ako ja sa celý deň na slniečku vyhrieva! Lastovičky ho počúvali iba letmo, mali veľa práce. Usilovne opravovali staré hniezda a budovali nové. V gaštanovej aleji sa ozval bicyklový zvonček. Vracala sa dievčička. Vkolaka sa jej rozbehol oproti. Skákal okolo bicykla a veselo štekal, vyprevadil ju až k chalupe. Čo je v škole nové?"" spýtal sa strigôň. „Nič, čo by si ty, dedko, nevedel,"" Šibalsky odvetila dievčička. „Hneď som si to myslel,"" pyšne povedal strigôň. „Mohol som (a aj sám všetko naučiť, nemusela si sa vláčiť do školy."" „Ja tam rada chodím,"" usmiala sa dievčička. „Prečo?"" „Lebo sú tam deti."" „Aha!"" zvolal strigôň a poškrabal sa za uchom. „Dedko, nešiel by si so mnou do lesa? Vonku je tak pekne..."" zaprosila vnučka. „Úúúlohu, hú, hú, hú,"" varovne zahúkala z jelenieho parožia učená pani sova. „Najprv si sprav úlohu. Ja zatiaľ nakŕmim Vkolaka,"" povedal strigôň, obul si sedemmíľové čižmy a vyšiel na priedomie. Do lesa sa mu veľmi ísť nechcela. Všade bolo plno blata, sedemmíľové čižmy by sa v lese zabárali, boli by skoro ako obyčajné. „Pôjdeme len k rybníku,"" navrhol dievčičke, keď si napísala úlohu. „Blí2ia sa veľkonočné sviatky. Narežeme tam vŕbové prúty, upletieme veľký korbáč. Na Veľkonočný pondelok pôjdeme vyšibať čarodejnicu Omiclu."" uškrnul sa popod fúzy. Slniečko prijemne hrialo, pofukoval slabý vetrík. Hladina rybníka sa čerila, na brehoch žiarili zlatisté vŕby. Z vody sa vyhodil hovoriaci kapor, urobil pozdravný premet. Vitaj, dievčička!"" „Ahoj, kapor!"" zakývala mu dievčička. Strigôň odrezal z najväčšej vŕby osem dlhých prútov a namočil ich na priedomí do koryta s vodou, aby boli ešte ohybnejšie, aby sa in ľahšie plietlo. Prišla Veľká noc. Strigôň uplietol korbáč, vyčaril maľované kraslice, čokoládové kuriatka a zajačiky. Čo ak ťa prídu spolužiaci vyšibať?"" nadhodil strigôň. „Musíme byť pripravení."" „Strigôňa sa deti boja,"" zavrčal Vlkolak. „Ale moju malú dievčičku majú rady!"" namietol strigôň. „Úúvidíme. úúvidime,"" zahúkala z jelenieho parožia učená sova a dôležito šuchorila perie. Veru uvidime!"" tvrdil strigôň. „Uvidíme, čo sme ešte nevideli, lebo ja dievčičku studenou vodou oblievať nedovolím! A ty"" obrátil sa na Vlkolaka, „zajtra ani ňufák nevystrč z búdy, aby sa ta chlapci nezľakli!"" Vstávaj, dievčička, rýchlo, už idú!!!"" budil strigôň vnučku v pondelok ráno. Alejou sa ponáhľali šibači s korbáčmi. Janko niesol vedierko. O chvíľu sa nahrnuli dnu. „Úúúha, úúúha,"" húkala prekvapená pani sova. Vtom chcel Janko dievčičku obliať, ale vedierko bolo prázdne. „Zabudol vodu, chichichi,"" smiali sa mu chlapci. „Na dvore je plné koryto!"" vytrhol mu Paľko z ruky vedierko a vybehol na priedomie. Načrel, vrátil sa a chcel dievčičku obliať, ale vo vedierku bolo zas len zopár kvapiek. „Nevieš ani vody nabrať? oboril sa nášho Miško, vytrhol mu vedierko, vybehol, hneď sa vrátil a rozohnal sa, ale na dievčičku padla zas len kvapka. „Hahaha,"" rehotal sa strigôň. Chlapci zostali zarazení. Vystrašene sa obzerali. „Dobre, chlapci."" posmelil ich strigôň. „Dobre ste moju vnučku vyšibali!"" Tváre sa im rozjasnili, až keď in dievčička rozdala maľované kraslice, čokoládové kuriatka a zajačiky. „Nezabudnite prísť aj o rok."" pozýval ich strigôň. „Prídeme."" prisľúbili chlapci a ponáhľali sa ďalej. „Ja som na vodu nezabudol,"" čudoval sa cestou Paľko. „Aj ja som nabral,"" hneval sa Miško. „Keď som došiel do strigôňovej chalupy, vo vedierku voda bola!"" tvrdil aj Janko. Ale ani mocný strigôň neobišiel lepšie. Trepal sa s plným vedrom do čarodejníckeho mlyna, no keď chcel Omiclu obliať... vedrom. Kam sa voda podela? Kam zmizla?"" „Ej, ty striga!"" nazlostene buchol o zem prázdnym Chachachá!"" chichúňala sa čarodejnica, ako prešla strigôňovi cez rozum. Či len ty vieš čarovať?"" „To bola oblievačka, dedko!"" celý deň sa tomu smiala dievčička."
276;3;P;"Zalieval som kvety vo váze. Mama vraví: „Také sú tie kvety pekné, že môžem na nich oči nechať. Veľmi som sa zľakol. Pozerám do visy, no mamine oči tam, chvalabohu, nie sú. A nie je doma ani Maroš. „Kde je Maroš?"" pýtam sa. Vzal nohy na plecia a šiel preč, znela mamina reč. Nevedel som si predstaviť, ako mohol ísť, keď mal nohy na pleciach. Nemal som však kedy o tom rozmýšľať, lebo. „Takú mám od starosti ťažkú hlavu, že už ju ani neunesiem,"" počuť z izby otcov hlas. Rýchle utekám podoprieť oteckovi hlavu. Brat Maroš prišiel až napoludnie. „Polievka je samé oko,"" hovorí a hlasno chlípe z taniera. Keď je polievka samé oko - myslím si -, potom vidí aj môjho brata, ako ju neslušne je. Odpoludnia som šiel za otcom do záhrady. „No len pod!"" kýva na mňa otec. „toľko je tu práce, že mi idú ruky odpadnúť"" Dobehol som celý nešťastný za otcom, no on na mňa spusti: „Chlapče, čo ti to stále v hlave vŕta!?"" Neodpovedal som. Čože by mi mohlo v hlave vŕtať? Ani nebožiec, ani krt. Keď nás mama volala večerať, bol som riadne hladný, no otcovi vraj v žalúdku hudci húdli. A mama jemu: Ach, ty moja hlava strieborná"" Večera bola znamenitá. Snáď preto sa otec začal mame líškať, že má zlaté ruky. Nejde mi do hlavy ani to, ako nožom mátaj, človek, husaciu kožu, otec železné nervy brat po otcovi železné zdravie. Takto to u nás beží celé dni. Najhoršie sa mám ja. Ničomu nerozumiem. Najlepšie je v noci, keď všetci spia. Vedy i ja pokojne na kanape drevo pílim."
277;3;P;Každý rok na Veľkú noc vyletí zo svojej skrýše v stene Muráňa záhadná kačka, zamieri nad Javorinskú Širokú a stratí sa za ňou. Kdesi v závere Bielovodskej doliny znesie zlaté vajce a znova sa vráti do jaskyne v Muráni. Starí ľudia hovoria, de to vajce môže získať len mládenec čistý a statočný, ktorý je v núdzi a peniaze naozaj potrebuje. Nuž veru, taký ja nie som, pomyslel si kedysi Stašek Chovanec z Jurgova, ktorý sa ešte nedávno túlal so zbojníkmi po poľskej strane. Všeličo sme stihli povyčíňať, mali sme dievčatá i dajaké zlatky sme stihli nahonobiť... Ale nezaškodilo by, keby ešte niečo pribudlo! A zaumienil si, že on kačku chytí a prinesie domov, nech len jemu zlaté vajcia znáša! Na Veľký piatok sa vybral pod stenu Ganku. Tam sa ukryl za balvanmi a čakal. Presne na pravé poludnie sa spoza Javorinskej Širokej vynorila snehobiela kačka, zakrúžila nad dolinou a zosadla na breh plesa. Otriasla sa, poobzerala na všetky strany a vbehla medzi balvany, neďaleko od miesta, kde sa skrýval Staśek. Zaliezla tam, aby mohla vajce zniesť pomyslel si Stašek. Teraz ju najskorej dostanem! Pustil sa za kačkou. Stačilo pár skokov a zbadal ju. Na okamih zmeravel. To keď sa jeho pohlaď stretol s plachými očami bielej kačky. No Stašek hneď nezaváhal. Vrhol sa na hu a pevne ju zovrel mocnými rukami. Kačka z vrieskla, zapišťala, začala sa metať, ale Stašek nepopustil. Strčil ju pod halenu a zberal sa na odchod. V tej chvíli... Čo sa stalo? Kam sa podel Stašek? A odkiaľsi na brehu lesa nabral obrovský balvan, ktorý tam predtým nebol? Záhadná kačka vzlietla, naposledy zakrúžila nad dolinou a stratila sa smerom k Muráňu. V Jurgove čakali na Staška Chovanca. No neprichádzal! Pomysleli si: Iste sa zas pridal ku zbojníkom a užíva si slobody. Nikto ani len netušil, aký trest ho stihol za lakomosť. Ostala len skala na brehu Kačacieho plesa. Ale tá mlčí a nikomu nič neprezradí.
278;3;P;"Žil starý vodník Mokrofúz na dne starej rieky. A pretože žil už niekoľko storočí, nebol taký, ako o ňom rozprávajú rozprávky: nechytal totiž ľudí za nohu a nesťahoval ich pod vodu a neschovával dušičky pod hrnčíčky. Nie! Bol to vodník prevychovaný tými dlhými stáročiami, neveril na povery, a pretože vedel, že žije v modernom čase, správal sa moderne a rozumne. „Načože by mne boli dáke dušové pary pod hrnčekmi,"" vravieval všetkým pod- vodným obyvateľom. . Dušami sa jeden nenasýti, do duše sa ani neoblečieš, za dušu si ani lízanku nekúpiš, ibaže jednému zavadzajú v špajzi a zaberajú miesto na kompótové fľaše"" Tak hovoril ten rozumný vodník a k takýmto myšlienkam vychovával aj svojich troch zelených synov. Žili si teda v rieke všetci spokojne. plátali pri mesiačiku siete na vodnícky volejbal a bola to taká príjemná zelená rodina. Jedného dňa pocítil starý Mokrofúz reumatické bolesti. „Zelenáči, povedal svojim trom synom. „Prežil som už päť storočí a vidí sa mi, že prichádza staroba. Možno si ešte požijem zo dve-tri storočia, ale aj tak treba mys- liet na budúcnosť. Jeden z vás prevezme po mne vládu nad touto riekou aj všetkými sieťami, aj kompótovými hrnčekmi. Myslím, že to nemusí byť najstarší. Ml by to byť najrozumnejší z vás troch."" A celá zelená rodina začala rozmýšľať, ako by sa dokázalo, ktorý z tých troch zelenáčov má najviac rozumu. Nakoniec rozhodol otec: „Pôjdete do sveta,"" povedal svojim trom zelenorodencom. „Pôjdete, a ktorý z vás mi prinesie z tejto rieky najcennejšiu vec, ten bude mojim nástupcom."" Naštartovali teda mladi vodníci a odfrčali poslušne proti prúdu. Ako tri podvodné motorky. Pláva si najstarší syn Mokronos a odrazu len zbadá na udici chytenú rybu Belicu. „Zachráň ma, Mokronoštek,"" volá zúfalá a zaháčkovaná rybka. „Zachráň ma, dobre sa ti odmením! a ufujazdil, ako keď strelí. Mokronos pozdvihne nosa vraví: „Prepáč, ale nemám čas na podobné pletky"" Druhý syn Mokrovlas tiež pláva proti prúdu a tiež začuje zúfalý nárek zaudicovanej Belice. tou pre svojho otca Mokrofúza, nesmiem strácať ani minútu."" A odplával do druhej „Nemôžem ta zachrániť"" zavolá na hu. „Ponáhľam sa za svetovou drahocennosti riečnej zákruty. Tretí syn, Mokráčik. Pláva si taktiež proti prúdu a taktiež začuje nárek chytene) „Oj, ty moja chudinka! Ale ta ten háčik škaredo nachytal! Ukuť, nech la od hačkám, veď by si nám zahynula."" Odhačkal Mokráčik ten škaredý háčik, Belica radostne plesla nad vodu, trikrát si vyplákala poranenú papuľku a vraví: na miesto, kde odpočíva najväčšia drahocennosť, za ktorou túži srdce tvojho sta- „Ďakujem ti, Mokráčik, dobre sa ti odmením. Pod so mnou, zavediem ta ručného otca,"" „To nemuselo byť."" povedal Mokráčik skromne, ale aj tak sa poslušne pobral Keď slnko zapadlo a na nebo sa vykotúľal mesiac, zlatý ako čerstvo upečený za dobrou rybkou. oškvarkový pagáčik, zastali synovia pred otcom Mokrofúzom. „Vitajte!"" povedal staručký vodník. Vitajte, synovia, a ukážte, čo ste mi priniesli."" Najstarší syn Mokronos vraví: „Priniesol som ti, otec môj zelený, najvzácnejšiu vzácnosť, aká bola v tejto našej milej tečúcej chalupe."" A podal Mokrofúzovi nie škaredý. ale predsa len mierne prederavený trojlitrový hrniec. Mokrofűz poprezeral vzácnu nádobu a vraví „Nuž, trojlitrový hrniec v dnešných časoch je naozaj Vzácnosťou. Len neviem dosť dobre, na čo mi bude, keď nechytám dušičky pod hrnčíčky a na kompót sa táto veľkosť nehodí. Ale dobre, možno sa na niečo zíde."" Druhý syn, Mokrovlas, predstúpil pred otca a vraví: „Ja som našiel takú vzácnosť, o akej sa nikomu ani nesnívalo."" A podal otcovi prsteň z čistého zlata, ktorý v tej rieke stratila jedna neostražitá plavkyňa. „No, toto je naozaj veľká vzácnosť, len neviem dosť dobre, načo mi bude. Poprezeral si Mokrofúz prsteň a vraví: Chlapovi prstene nepristanú a vodníkovi ešte menej. Porozmýšľam, či by sme ho nemohli prípadne nejako speňažiť."" Vedy pristúpil najmladší syn Mokráčik a nesmelo šepol: „Priniesol som ti, otecko, len skromný darček. Ale možno sa ti zíde na staré kolená."" A podal otcovi síce trochu obnosenú, ale načisto zachovanú papuču. „Syn môj drahý, srdce moje bledozelené!"" zajasal starý Mokrofúz a oči sa mu naplnili slzami radostného dojatia. „Toto som hľadal, to je pre mňa vzácnosť nad vzácnosti! Lebo pred sto rokmi našiel som v tretej zákrute našej riečky jednu vynikajúcu papuču ručnej výroby a odvtedy - teda celých sto rokov - hľadám a hľadám. Či k nej nenájdem dáky pár. Ty, syn môj najmladší, vyplnil si konečne moju storočnú papučovú túžbu, ty si ma obšťastnil a na staré kolená najlepšie zaopatril."" A starý vodník Mokrofúz pobozkal syna Mokráčika na mokré čelo a vymenoval ho za svojho nástupcu. Potom si natiahol tie dve vytúžené papuče, sadol si pod starú vŕbu, slnil sa v mesačnom svite a pokojne si pod zelené fúzy nôtil: „Ja som bača veľmi starý... A z vĺn hľadela naňho dobrá rybka Belica a tiež sa radovala, že pomohla tomu, kto pomohol raz jej. Lebo aj pod vodou môže panovať horúce a dobré kamarátstvo. Tak ako medzi nami, tu na suchu."
279;3;P;"Hľadel raz Tuláčik von oknom. Stál a hľadel tam, kde by už malo voľačo byt. Ale nebolo tam vôbec nič. A povedal Kláre: „Stojím a hadím von oknom až tam, kde by už malo voľačo byt. Ale vôbec nit tam nie je. Aspoň niečo také, na čo by sa oplatilo tak dlho hľadieť,"" dodal. A zatvoril oči, pretože mu bolo ľúto nechať ich nadarmo otvorené. „Tak sa pozri voľakde inde."" povedala Klára. „Možno tam bude niečo, na čo sa oplatí hľadieť aspoň chvíľku."" Tuláčik otvoril oči a pozrel sa voľakde inde. Voľakde inde visel obrázok. Na obrázku bol fúzatý muž. Na hlave mal vysokánsky klobúk. A na rukách biele rukavice. „Kto je to? opýtal sa Tuláčik. „Kúzelník,"" povedala Klára. Ale Tuláčik nevedel, kto je to kúzelník. „A kto je to KÚZELNÍK?"" „Kúzelník je každý, kto robí kúzla,"" povedala Klára. Ale Tuláčik nevedel ani to, čo sú to kúzla. „Kúzla sú,"" vysvetľovala Klára, „keď kúzelník zloží z hlavy vysokánsky klobúk. Keď poklope paličkou na klobúk a povie ČÁRY-MÁRY! A keď potom z klobúka vytiahne bieleho králika. Alebo zobudí spiaceho medveďa. Alebo vytiahne z rukáva prúžkovanú myš."" Tuláčik sa zahľadel na obrázok s kúzelníkom. A predstavoval si, ako zdvihne kúzelnícku paličku. Ako si zloží klobúk. Ako povie ČÁRY-MÁRY! A ako z klobúka vytiahne bieleho králika. Alebo urobí voľajaké iné kúzlo. A bežal po klobúk. A po metlu. ČÁRY-MARY"" búchal Tuláčik metlou po klobúku. Ale z klobúka nič nevytiahol. Tuláčik sa náhlil za medveďom, ktorý práve spal. ČÁRY-MÁRY! ČÁRY-MÁRYT"" volá Tuláčik na medveďa. Ale spiaci medveď sa ani nepohol. Tuláčik utekal po kabát. ČÁRY-MÁRYI ČÁRY-MÁRY! dohováral Tuláčik kabátu. Ale z kabáta nevypadla ani jediná prúžkovaná myš. „Nijaké kúzlo sa mi nepodarilo,"" a oval sa Tuláčik. „Keby aspoň jedna myš vypadla z rukáva."" Klára sa pozrela na Tuláčika. Bol veľmi smutný. Tuláčik."" povedala odrazu Klára. „Svet je plný čarovných vecí, Len sa pozri!"" Tuláčik a Klára si sadli pred dom. A pozerali sa na svet okolo seba. Na trávu, ktorá rástla sama od seba. Na kvety, ktoré. voňali nevedno prečo. Na potok, ktorý prúdil a nikto ho nepohádal. Na velikánske slnko nad sebou, ktoré nik nemusel pridržiavať, aby nespadlo. Videl som aj niečo také, čo nie je vidieť("" povedal Tuláčik. „Ohne všetko na zemi."" Vietor."" povedala Klára. „Možno Vietor. povedal Tuláčik „Ale nie je ho vidieť."" Nakoniec všetko pohltila noc. Tuláčikovi sa zdalo, že je svet schovaný v jednom jedinom kúzelníckom klobúku. Takom veľkom, že sa do neho všetci pomestíme."
280;3;P;Bolo jedno mesto, ani veľké, ani malé, ani z dreva, ani zo železa, ale zo všetkého trochu. Trochu veľké, trochu malé, trochu z dreva, trochu zo železa. V tomto meste bola stanica, ani veľká, ani malá, ani z dreva, ani zo železa, ale zo všetkého trochu. Trochu veľká, trochu malá, trochu z dreva, trochu zo železa. Celé mesto je hore nohami, moji milí, teraz je poludnie a večer pricestuje na návštevu starosta Bisquit. Celé mesto je hore nohami, kvety sú hore nohami, policajti sú hore nohami, dychová hudba je hore nohami, hlavné nástupište je hore nohami. Teraz je poludnie a do večera musí byť stanica zasa na svojich nohách, kvety na svojich nohách, policajti na svojich nohách, dychová hudba na svojich nohách, hlavné nástupište na svojich nohách, teraz je poludnie a do večera už nezostáva veľa času. Počujete, v diaľke už hučí vlak, vrchný policajt volá, všetko je v poriadku, ale kdeže, vôbec nie je všetko v poriadku. Chýba predsa koberec, chýba dlhý červený koberec, po ktorom prejde starosta Bisquit z vlaku na radnicu. Všetko je v ťahu, všetka námaha s kvetmi, policajtmi, hudbou i nástupišťom je v ťahu. Čo teraz, moji milí, ale vrchný policajt má spásonosný nápad, vrchný policajt je chlapík, zabehne na policajnú stanicu a otvorí trezor, spí v ňom drobný trpaslík s dlhou bielou bradou. Vrchný policajt už ani nevie, prečo ho vlastne zatvoril, možno nemal občiansky preukaz, možno prešiel na červenú cez križovatku, ale teraz na tom nezáleží. Vrchný policajt vyberá trpaslíka z trezoru a hybaj na stanicu. V diaľke už hučí vláka deti kričia, načo je ten trpaslík s dlhou bielou bradou, ale vrchný policajt sa smeje a prináša zo skladu červenú farbu, deti kričia, načo je tú červená farba, ale vrchný policajt sa smeje. Natiera červenou farbou trpaslíkovu bradu. U2 to nie je brada, ale dlhy, dlhý červený koberec. Konečne bude všetko v úplnom poriadku. Do stanice vchádza vlak a starosta Bisquit kráča po dlhom čer- venom koberci, deti mávajú kyticami, dychová hudba vyhráva, vrchný policajt sa smeje a starosta kráča po koberci, ktorý je hladký ako brada, ale zrazu padá, zrazu zakopne o niečo a celé vítanie je v ťahu, lebo ako možno vítať starostu, ktorý leží na koberci, ako možno vítať starostu, ktorý spadol ako zrelá hruška. Celé mesto sa smeje a vrchný policajt zúri na trpaslíka. Vidíš, hlupák, to sa musíš zapliesť práve starostovi pod nohy, celé mesto sa sme- je a vrchný policajt zatvára do trezoru dychovú hudbu i trpaslíka, kvety i deti, hlavné nástupište i stanicu. Ja vám ukážem, kričí, poriadok je poriadok, rozumiete, dva roky máte zarazenú vychádzku!
281;3;P;"Stretol sa raz medveď komárom a takto sa mu prihovoril: „Keby si vedel, komár, aký ťažký je môj život! Každý si myslí, že ja najlepšie viem, kde je med, veď preto ma aj volajú medveď- ale nik netuší, čo sa ja nadriem, čo sa nachodím, čo sa nahľadám, kým na nejaký med natrafím! A keď už natrafím, keby si vedel, koľko včiel ma pichne do ňufáka, kým sa k nemu dostanem, koľko utrpenia musím zniesť pre kvapku medu. O čo ľahší život máš ty, komárí Už dlhší čas ta pozorujem a vidím, že tebe stačí sadnúť si na hociktorého tvora, a hneď máš v sebe kvapku jeho krvi."" „Rob to aj ty tak,"" zasmial sa komár. Veď sa chystám, vraví medveď. „Ale zmeniť spôsob obživy, to nie je iba tak. Som zvyknutý na sladký med - je sladká aj krv?"" „Ako ktorá,"" vraví komár. „Jeden tvor má krv sladkú viac, iný menej. „A ktorý tvor ju má najsladšiu? A v ktorej časti tela?"" vyzvedal sa medveď. Človek, vraví komár. Človek má najsladšiu kry -a najmä jazyku. Čo ten vie tým jazykom narozprávať sladkých tretí! Ľudská krv z jazyka je sladšia ako med."" Potešil sa medveď, že sa to dozvedel. Vyhladol medveď, odkedy sa rozhodol zanechať med a prejsť na ľudskú krv. Aby sa však mohol dosýta napiť ľudskej krvi, musel najprv nájsť človeka. Pobral sa ho medveď hľadať. Ide, ide a postretne malého chlapca, čo sa vybral do lesa na jahody. Stoj!"" pristaví ho. „A povedz, či si ty človek?"" Chlapec sa nezľakol medveďa a pokrútil hlavou: Ja človek? Kdeže! Ja ešte len budem odvekom, ale najprv musím podrásť"" „A koľko ti potrvá to podrastenie? Krátko či dlho?"" „Ešte dosť dlho,"" vraví chlapec. „Toľko ja nemôžem čakať,"" vraví hladný medveď. „Bež si a podrastaj."" Ide hladný medveď ďalej a stretne zhrbeného starca, čo sa vybral do lesa na raždie. „Stoj! pristaví ho. „A povedz, či si ty človek! Ani starec sa nezľakol medveďa a pokrútil hlavou: „Ja človek? Kdeže býval som ja človekom, keď som sa ešte nehrbil, keď som chodil vystretý ako struna. Ale to bolo dávno."" „A možno nie tak dávno. Ako dávno veľmi divno,"" vraví starec. „Škoda, stretí sme sa trochu neskoro,"" vraví hladný medveď. „Choď a hrb sa."" Ide medveď ďalej a stretne husára na koni - práve sa husár vracal odkiaľsi z vojny a pri páse sa mu hompáľala dlhá šaľba. „Stoj!"" pristaví ho medveď. „A povedz, či si ty človek? Ak sa medveďa nezľakol chlapec, ak sa ho nezľakol starec, to by tak vyzeralo, aby sa ho zľakol husár, Ani husár sa nezľakol medveďa a spustil naňho z vysokého koňa: „A kto iný by mal byť človek, ak nie ja? Pravdaže som človek! Človek v najlepšom kvete síl!"" „To rád počujem,"" povedal medveďa vrhol sa na husára, že sa napije krvi z jeho jazyka. Lenže husár s tým rátal. Skôr, ako sa k nemu mohli medvedie zuby priblížiť, vytiahol z pošvy šaľbu a začal medveďa rúbať, kde začiahol - len tak z neho crčala krv, „Jaj, jaj!"" zjajkol nešťastný medveďa dal sa na útek. Chachacha!"" niesol sa mu v pätách husárov smiech. Až keď bol v tretej doline a nepočul už husára, medveď sa konečne zastavil a začal si lízať rany. Tam ho našiel komár, ktorý práve letel okolo, a spýtal sa ho: Tak čo, medveď? Už si ochutnal krv z ľudského jazyka?"" „Ani mi ľudský jazyk nespomínaj! zaskuvíňal medveď. „Zle si mi poradil! veď to ti je taký dlhý a ostrý jazyk a človek nim tak seká, že mi vypil skoro všetku krv. Teraz si lížem rany. Vidím,"" vraví komár. Vidím, e si sa napokon rozhodol ochutnať vlastnú krv. A aká je? „Najsladšia!"" vraví medveď. „Keď ti ide o život, zistíš, že vlastná krv je najsladšia!"" „Nuž, predsa len som ti dobre poradil!"" zvolal komár, . keby nie ľudského jazyka, nikdy by si na to neprišiel!"""
282;3;B;"Na samom kraji chotára pristaval medveď komára. Krvou sa živíš -povedz, bratku, ktorý tvor ju má takú sladkú?"" „Kto? Človek, milý valibuk! Ak toto nevieš, tak si drúk!"" A stratil sa mu vo vzduchu, Pri uchu pišťal juchuchú! Premýšľal medveď do večera. Hm, človek. To je nové zviera. Kadiaľkoľvek som teda šiel, nič takého som nenašiel. Potúlam sa ja sem a tam a po ceste sa popýtam."" Tak ide, ide, chlapca stretne. „Nie si ty človek, prosím pekne?"" „Nie. Ja len budem človekom."" A takto nevieš o niekom?"" „Kto chce nájsť, nech si pohľadá"" „Toto je teda záhada ..“ Ide medveď a starca stretne. „Nie si ty človek, prosím pekne?"" „Nie, ja som len bol človekom. „A takto nevieš o niekom? „Hľadaj si, hľadaj, len sa tráp. Sám ti to povie, kto je chlap!"" Dudre si medveď: -To je spolok! Netreba mne to, čo už bolo. A čo len bude, ani tak. Ten človek to je pekný vták."" A tuto pred ním na koni šabličkou husár zazvoní. „Stoj! Ty si kto?"" Ja? človek s hlavou!"" „Tak a zjem! Tu je moje právo!"" A husár puškou zamieri: „Jedz, strela tvojej materi! Zavinšujem ti dobrú chuť. Vieš, mohlo by ti zapadnú!"" A už mu kropí oba boky a maca v bokoch pália broky. Ak uteká, tak uteká. „Fuj! Nešťastná krv človeka! Tá štípe ako paprika! Veď ja ta chytím, zbojníka, Ja ti to vrátim, komárisko! Neopováž sa ku mne blízko!"" Komár sa nad ním iba smial a letel ďalej v šír a dial. Ozval sa mu až z lesných lúk. „Nevravel som ti, že si drúk?"""
